season	season_episode	series_episode	episode_rating	episode_name	episode_notes	air_date	judge1	judge2	judge3	appetizer	entree	dessert	contestant1	contestant1_info	contestant2	contestant2_info	contestant3	contestant3_info	contestant4	contestant4_info
"16	3	189	8.9	Mix and Mache	Roy Handler is the brother of comedian Chelsea Handler. The Kaiserschmarrn in the dessert round was an instant mix.	June 16, 2013	Aarón Sánchez	Alex Guarnaschelli	Marcus Samuelsson	pickled sausage, mache, blood oranges, southern cabbage	lobster bisque, baby leeks, daikon, squid	green cerignola olives, honey distilled liqueur, gala apples, Kaiserschmarrn	Roy Handler	Caterer  Haute Mess Catering  Los Angeles  CA	Lara Paul	Executive Chef  Rivals Steakhouse  Austin  TX	Mogan Anthony	Executive Chef  Village Social  Mount Kisco  "
16	4	190	8.3	Gyro We Go Again	
"16	5	191	8.5	Big Fish, Small Basket	Chef Eakins works at Ditch Plains, which is owned by Chopped judge Marc Murphy.	June 27, 2013	Scott Conant	Geoffrey Zakarian	Aarón Sánchez	seitan, purple ninja radishes, mezcal, canned chili	liquid aminos, beet greens, alfredo sauce, fluke	speck, sfogliatelle, crabapples, brewer's yeast	Paul Joseph	Executive Chef  FireBird  "
"16	6	192	7.9	Teen Invasion	This was a special all-teen episode with teenage competitors. The first round was extended to 30 minutes instead of the usual 20 minutes. The eliminated contestants each received a $1,000 gift card.	July 2, 2013	Marc Murphy	Amanda Freitag	Marcus Samuelsson	grapefruit, tuna, hen of the woods mushrooms, graham cracker cereal	leg of goat, hummus, rhubarb, frisée	kettle-style potato chips, black currant jam, red Anjou pears, Japanese mayonnaise	Tyler Bloch	age 14  from Jericho  "
16	7	193	7.8	Mochi Obliged	
"16	8	194	7.3	Sweet Surprises	ach basket had a special sweet confection hidden under a separate cloche that had to be used in their dish.	July 16, 2013	Scott Conant	Alex Guarnaschelli	Marcus Samuelsson	rack of wild boar, broccolini, hazelnuts, vanilla fondant cake	duck, cardoons, preserved lemons, macaroons	clementines, cheese wedges, Aleppo pepper, frozen hot chocolate	Jemell Simpson	Caterer  Taste My Expression Catering  "
"16	9	195	8.5	Break a Crab Leg!	Chef Marino works with Chopped judge Alex Guarnaschelli at The Darby.	July 30, 2013	Marc Murphy	Maneet Chauhan	Geoffrey Zakarian	babaco, gìo lụa, chive blossoms, quark	crab legs, sweet vermouth, asparagus, Mexican wedding cookies	red bean paste, jicama, cilantro, bacon jam	Chris Houlihan	Chef de cuisine  AFrame  Los Angeles  CA	Lucas Marino	Sous chef  The Darby  "
16	10	196	7.8	Walk on the Whelk Side	
"16	11	197	8.6	Chopped Family Feud	The contestants were two pairs of brothers who have each appeared together on Iron Chef America. They were competing head to head in this episode for a chance to win $10,000 for charity. Both Campanaro brothers forgot a basket ingredient in their round 1 dishes (Lou forgot the falooda glass noddles and Joey forgot the cape gooseberries), but both moved on due to Chef Kent's dish reading as too salty and his usage of the cape gooseberries as a garnish like almost having left off the ingredient as well, as cited by the judges.	August 11, 2013	Marc Murphy	Amanda Freitag	Geoffrey Zakarian	cape gooseberries, falooda glass noodles, watercress, bacalao	beef tip cap, cognac, green bean chips, cinnamon rolls	spaetzle, moustalevria, walnuts, Japanese cola candy	Kent Rathbun	Charity: March of Dimes	Lou Campanaro	Charity: Philadelphia Animal Welfare Society	Joey Campanaro	Charity: El Farro De los Animales	Kevin Rathbun	Charity: Atlanta Community Food Bank"
"16	12	198	6.9	Extreme Halloween	This was a Halloween themed episode. During the appetizer round, Ted warned the chefs that the eel had to be fully cooked due to the toxic nature of the eel's blood if left raw. Chef Creger, who never cooked eel before, ignored Ted's warning and served his eel raw, which led to his elimination in the appetizer round. The episode originally aired prior to Halloween Wars.	October 6, 2013	Marc Murphy	Alex Guarnaschelli	Chris Santo	potato crisps, eel, candy bats, coagulated pig blood	gummy skull, collard greens, sweetbreads, dehydrated weaver ant eggs	candy blood, deviled eggs, pâte sucrée, buffalo chestnuts	John Creger	Head Chef  Gallow Green  "
16	13	199	
"17	1	200	8.6	Wasted!	All of the ingredients of the baskets were scraps - ingredients that are normally thrown away.	August 13, 2013	Geoffrey Zakarian	Alex Guarnaschelli	Marcus Samuelsson	pickle juice, herb stems, overripe tomatoes, fish carcass	wilted carrots, potatoes with eyes, parmesan cheese rinds, meat trimmings	ends of bread loaves, squeezed orange halves, used coffee grinds, hardened brown sugar	Molly Peck	Caterer  The Vanilla Orchid Catering  Austin  TX	Dylan Hallas	Executive Chef  Petit Ermitage Hotel  West Hollywood  CA	Parind Vora	Chef and Restaurateur  Restaurant Jezebel  Austin  TX	Garrett Eagleton	Freelance Chef  The Meat Hook  Brooklyn  "
17	2	201	7.7	Keep On Trucking	The original airing of this episode was as a lead-in to Food 
"17	3	202	7.9	Sports Stars	This was a special episode where the competitors were sports stars competing for charity.	September 3, 2013	Chris Santos	Alex Guarnaschelli	Marcus Samuelsson	salmon filet, candy-coated peanuts, redbor kale, lemon-lime sports drink	spinach, filet mignon, almonds, chocolate covered marshmallows	protein powder, caramel coated popcorn, tangelo, olive oil cake	Tiki Barber	Charity: The Fresh Air Fund	Chuck Zito	Charity: St. Jude Children's Research Hospital	"
"17	4	203	8.8	Hero Chefs	All of the competitors in this episode are heroes in their community. Judge Cheryl Barbara was the winner of the first school chef episode, Class Acts (in season 9).	September 10, 2013	Marc Murphy	Amanda Freitag	Cheryl Barbara	chicken soup, ground pork, pattypan squash, barbecue sauce	scallops, Chinese broccoli, tamarillos, finger limes	aged cheddar cheese, Granny Smith apples, hamburger buns, vanilla frosting	Wilhemina Bell	Executive Chef  Children's Village/Program Coordinator  Philadelphia  PA	Pedro Rodriguez	Head Chef  "
"17	5	204	8.4	We Love Leftovers!	The baskets were filled with leftovers.	September 17, 2013	Scott Conant	Chris Santos	Geoffrey Zakarian	burger, fortune cookies, sautéed broccoli, lasagna	BBQ ribs, french fries, German chocolate cake, chili	cooked corn cobs, pitcher of sangria, duck sauce, stale plain doughnuts	Josh Watkins	Executive Chef  The Carillon  Austin  TX	Krissy Kerwin	Private Chef  Los Angeles  CA	Aatul Jain	Executive Chef  St. Clare's Hospital  Denville  "
"17	6	205	8.6	Count Your Chickens	This episode's baskets had chicken products in every round.	September 24, 2013	Aarón Sánchez	Amanda Freitag	Marcus Samuelsson	chicken livers, marrowfat peas, watermelon, chicken tenders	chicken legs, chicken-flavored crackers, "
"17	7	206	8.2	Liver and Learn	""Chef Peacock's brother Darius Peacock is a two-time Chopped winner (in season 1 and in season 2's """"Chopped Champions"""" event).""	October 1, 2013	Chris Santos	Amanda Freitag	Geoffrey Zakarian	calf liver, lemon potatoes, pickled Chinese mustard greens, ranch dressing	quail, sumac, turnips, peanut crisp candy bars	yuzu marmalade, whipped cream cheese, hot sauce, corn flakes cereal	Shaquay Peacock	Sous chef  The "
"17	8	207	8.8	Brunch Boxes	ach basket contained ingredients commonly used to prepare brunch dishes.	October 15, 2013	Marc Murphy	Alex Guarnaschelli	Aarón Sánchez	quail eggs, kale, champagne, caviar	emu egg, pancake mix, bloody mary mix, lobster	Araucana eggs, waffles, maple syrup, Canadian bacon	"
"17	9	208	8.2	Circus Spectacular	ach basket included something with a circus theme. Chef Olson is the grandson of singer Glen Campbell.	October 24, 2013	Scott Conant	Chris Santos	Ron Ben-Israel	cotton candy, peanuts in the shell, corn dogs, Tokyo scallions	nachos, chicken fingers, candy apples, baby corn	snow cones, funnel cakes, popcorn, sour cream	Steve Yen	Sous chef  Catch  "
"17	10	209	7.9	Competition Italiano	This was an Italian-themed episode. In round 1, Chef Lisa forgot two basket ingredients but Chef Philip cut himself, and contaminated his food, so he was eliminated. In round 2, Chef Lisa forgot a basket ingredient again, resulting in her elimination.	October 29, 2013	Scott Conant	Alex Guarnaschelli	Maneet Chauhan	soppressata, pasta dough, newborn baby fish, limoncello	veal chops, bottarga, graffiti eggplant, caffé macchiato	figs, burrata, piadina, chinotto	Philip Meoli	Chef de cuisine  Brooklyn Pub  Brooklyn  "
"17	11	210	8.1	Redeemed or Re-chopped?	This episode featured four past runners-up. In the Entree Chef Rollins cut himself but finished his dishes. In the dessert round, Chef Rollins cut his finger again, contaminating his station enough where the judges found it unsafe to eat his dish, and the judges did not like Zoe's Dessert at all. However, they sent Kent home for not highlighting flavors as well as Zoe did and his cut finger costed him the win due to contamination.	"
"17	12	211	7.8	Cloche Call	Chefs Josh and Mike are brothers, with Josh being older.	"
"17	13	212	8.2	Celebrity Holiday Bash	This special holiday episode featured celebrities competing for a charity. As a food safety measure, at the start of the entrée round the competitors were informed that rosca de reyes contained several small baby Jesus figurines..	December 3, 2013	Geoffrey Zakarian	Maneet Chauhan	Amanda Freita	reindeer pâté, sparkling cider, candied ginger, jelly-filled donuts	rosca de reyes, wagyu rib-eye steaks, broccoli, cocktail sauce	Douglas fir brandy, plum pudding, dried persimmon, chocolate Santa	Antonio Sabato Jr.	Charity: Boys and Girls Club of Ventura	Dawn Wells	Charity: Terri Lee Wells' Discovery Museum for Children	Anthony Anderson	Charity: United "
18	1	213	8.5	
"18	2	214	8.4	Teen Talent	The contestants in this episode were teenagers competing to win a $40,000 scholarship to attend culinary school. The runner up received a $20,000 scholarship and the other two eliminated chefs each received a $5,000 scholarship. The contestants had 30 minutes in the appetizer round instead of the usual 20 minutes. Hunter Zampa is the youngest contestant to win a teen Chopped episode. Judge Joseph Brown is from the culinary schools at The Art Institutes, who sponsored the scholarship.	December 10, 2013	Joseph Brown	Alex Guarnaschelli	Marcus Samuelsson	swordfish steaks, broccoli rabe, tiger figs, cherry flavored drink	toaster pastries, filet mignon, truffles, heirloom tomatoes	strawberry mints, salt bagels, cream cheese, cotton candy grapes	Roxy Belfiore	age 15  from Deptford Township  "
"18	3	215	8.1	Tapas Time	All the chefs were required to make tapas in each round: as part of the challenge, they were tasked to create two dishes in the appetizer round, three in the entrée, and two in the dessert. Because of the change in the usual format, the first round was 30 minutes instead of the usual 20. Gemma ran across the kitchen with a fiery grill in the Entree Round, and she burnt her hands badly.	December 17, 2013	Amanda Freitag	Aarón Sánchez	Michelle Bernstein	Boquerones, pan de leche, gazpacho, head-on shrimp	Spanish tortilla, serrano ham, chayote, squid	Catalan creme, Cava, oranges, Marcona almonds	Andres Figueroa	Executive Chef  Antojeria La Popular  "
18	4	216	8.6	Waste 
"18	5	217	8.5	Firefighter Chefs	All the contestants in this episode were firefighters. Before starting the entrée round, Ted had the chefs light the saganaki with some alcohol and a lighter provided in the basket. The blow torch in the dessert basket was the first time a non-food item was featured in a basket.	January 12, 2014	Scott Conant	Alex Guarnaschelli	Marcus Samuelsson	wildfire lettuce, 'nduja, burrata, roti	ghost peppers, rack of wild boar, cucuzza squash, saganaki	wafer sheets, vanilla pudding cups, lemon soda, blow torch	Sal DePaola	FD"
"18	6	218	7.6	Hoofin' It!	Chef Fahr cut herself in the appetizer round. Fahr failed to notice the cut until after the round was complete, and enough blood was found on her station that the judges felt her dish was unsafe to eat.	January 21, 2014	Aarón Sánchez	Marcus Samuelsson	Alex Stupak	pickled pigs feet, butter beans, coleslaw mix, sweet potato chips	venison tenderloin, watercress, eggplant, pecan pie	chai tea latte, gala apples, black licorice, puff pastry	Ashley Fahr	Caterer & Food Stylist  "
"18	7	219	8.3	Pizza Perfect	The chefs were required to make pizza in each round.	February 2, 2014	Amanda Freitag	Alex Guarnaschelli	Bruno DiFabio	thin crust pizza dough, king crab legs, malta, vegan pepperoni	deep dish pizza dough, rabbit escabeche, Swiss chard, pineapple cheese spread	crescent roll dough, pickled apricots, salted caramel sauce, candied mushrooms	Sam "
"18	8	220	8.1	All-Burger Meal!	The chefs were required to make burgers in each round. Each chef was given a meat grinder to use.	February 9, 2014	Amanda Freitag	Alex Guarnaschelli	Spike Mendelsohn	veal shoulder, bean sprouts, Marsala wine, veal tongue	whole brisket, short ribs, pickle juice Popsicles, quail eggs	hamburger buns, chocolate peanut clusters, shaved coconut, sesame seeds	Megan Logan	Executive Chef  "
"18	9	221	7.7	Chocolate Competition	All the baskets contained some kind of chocolate. Phillip Frankland Lee is a multiple-episode winner of Guy's Grocery Games.	February 11, 2014	Aarón Sánchez	Maneet Chauhan	Christina Tosi	Mayan chocolate bars, chocolate martini, eggplant, pasta sheets	chocolate cake pops, white chocolate cocoa mix, quail, serrano peppers	cacao paste, peanut butter cups, baumkuchen, cherries	Pierre Coray	Private Chef & Caterer  Los Angeles  CA	Lucy Collins	Sous Chef  Costada Italian Steakhouse  "
"18	10	222	8.2	Bacon Baskets!	Bacon appeared in every basket.	February 16, 2014	Scott Conant	Amanda Freitag	Adam Sobel	Mangalitsa bacon, apple chips, horseradish leaves, smoked pork chops	Iberico bacon, pork loin, kimchi, dried cherries	applewood smoked bacon, poached pears, french toast, cracklings	"
"18	11	223	6.9	Beer Here!	very basket featured beer inside.	February 23, 2014	Scott Conant	Chris Santos	Greg Koch	toasted lager, hop drops, hickory smoked sausage, fried pickle	bourbon barrel aged tripled ale, beer taffy, beer cheese, beef tips	milk stout, stout beer jelly, soft pretzels, peaches	Larry Monaco	Private Chef  Los Angeles  CA	Hiep Le	Chef & Owner  Le Cellier  Marina del Rey  CA	Bradley Stellings	Consulting Chef  Japan	Lauren Kyles	Head Chef  Daily Grill & Public School  Los Angeles  CA"
18	12	224	8.5	Burn for the Worse	
18	13	225	7.7	An Egg Up	
"19	1	226	9	Ambitious Amateurs	This was an official all-amateurs episode with four home cooks competing. Soraya and Jackie forgot an ingredient in the first round (Soraya got chopped), then Jackie forgot an ingredient again in the second round (leading to her getting chopped).	February 4, 2014	Scott Conant	Alex Guarnaschelli	Geoffrey Zakarian	chicken tenderloins, paprika peppers, fennel, ginger preserves	tikka masala sauce, asian long beans, hanger steak, serrano ham croquettes	guava shells in syrup, cottage cheese, couscous, candied chick peas	Soraya Sobreidad	Loan Specialist/Drag Queen from Queens  "
"19	2	227	8.9	Return and Redeem	This episode featured past contestants who were eliminated, returning for a second chance at winning.	February 25, 2014	Scott Conant	Amanda Freitag	Geoffrey Zakarian	lime gelatin, prosciutto, celery, prawn cocktail chips	sour candy belts, quinoa, pickled turnips, red snapper	palm seeds in syrup, chocolate-covered raisins, dulce de leche, multi-grain cereal	Lauren Von Der Pool	""Episode 18.4 – """"Waste "
"19	3	228	8.3	Grandma vs. Grandma	All the contestants in this episode were grandmothers (some having experience in cooking professionally while others were home cooks/amateurs). The contestants had 30 minutes in the appetizer round instead of 20. The meatloaf mix was made of a mix of veal, pork, and beef.	March 4, 2014	Scott Conant	Amanda Freitag	Chris Santo	fillet of sole, popovers, ginger, bacon grease	meatloaf mix, sweet potatoes, green beans, Old Fashioned	oatmeal, dried currants, yuzu juice, vanilla ice cream	"
"19	4	229	8.8	Chopped Tournament of Stars: Sports Stars!	Part 1 of a 5-part competition for $50,000 for a charity of the winner's choice. The competitors in this heat were all athletes. The green juice included kale and ginger.	March 9, 2014	Geoffrey Zakarian	Alex Guarnaschelli	Marc Murphy	organic green juice, alligator, hen of the woods mushrooms, mini rainbow marshmallows	turkey tenderloin, double yolked eggs, pattypan squash, finger limes	liquid breakfast drink, pink wafer cookies, crystallized ginger, red bosc pears	Jackie Joyner-Kersee	Charity: Jackie Joyner-Kersee Foundation	Charles Oakley	Charity: Share Our Strength	Greg Louganis	Charity: Mending Kids International	Brandi Chastain	Charity: Bay Area Women's Sport Initiative"
"19	5	230	8.7	Tournament of Stars: Rachael vs. Guy!	Part 2 of a 5-part competition for $50,000 for a charity of the winner's choice. The competitors in this heat were on the show Rachel vs. Guy. In the appetizer round, Coolio was caught sneaking some lemon into his dish after time was called, and the judges cited this as a reason for his elimination. Lou forgot an ingredient in Round 2 and Round 3 resulting in his elimination.	March 16, 2014	Chris Santos	Maneet Chauhan	Marc Murphy	beef tongue, Chinese broccoli, candied citron, microwavable chocolate cake	buffalo hanger steak, watermelon cucumbers, pizza, ranch dip	Peanut caramel chocolate bars, Chinese five spice, coconut milk, banana chips	Coolio	Charity: Jarez Music Foundation	Penn Jillette	Charity: Opportunity Village	Lou Diamond Phillips	Charity: Share Our Strength  "
"19	6	231	7.8	Chopped Tournament of Stars: Comedians!	Part 3 of a 5-part competition for $50,000 for a charity of the winner's choice. The competitors in this heat were all comedians.	March 23, 2014	Chris Santos	Maneet Chauhan	Geoffrey Zakarian	picked pig lips, spinach, polenta, gummy fried eggs	beer can chicken, jalapeño popper, collard greens, truffle honey	cinnamon chips, cheese curls, vanilla cupcakes, apple cider	Tommy Davidson	Charity: Down Syndrome Foundation of Florida	Robert Wuhl	Charity: The Amanda Foundation	Sinbad	Charity: Downtown Dog Rescue	Gillian Vigman	Charity: Go Campaign"
"19	7	232	8.6	Chopped Tournament of Stars: Actors	Part 4 of a 5-part competition for $50,000 for a charity of the winner's choice. The competitors in this heat were all actors.	March 30, 2014	Maneet Chauhan	Alex Guarnaschelli	Amanda Freita	squid, popcorn on the cob, dinosaur kale, candy blood	steamed spiny lobster, pink fermented lemons, amaro, French breakfast radishes	star cookies, strawberries, mascarpone cheese, Buddha's hand	Tasha Smith	Charity: Planned Parenthood	Lucas Grabeel	Charity: Harmony Project	Peter Scolari	Charity: Copd Foundation	Michael Imperioli	Charity: Pure Land Project"
"19	8	233	8.9	Chopped Tournament of Stars: Finale	Part 5 of a 5-part competition. The winners of the previous four heats competed for $50,000 for their charity of choice.	April 6, 2014	Marc Murphy	Alex Guarnaschelli	Geoffrey Zakarian	10 pack of tacos, escarole, dragon fruit, vanilla ice cream	peking duck, brussels sprouts, cotton candy, veal demi glaze	blueberry goat cheese, pecans, churros, champagne	Carnie Wilson	Charity: Weight Loss Surgery Foundation of America	Gillian Vigman	Charity: Go Campaign	Brandi Chastain	Charity: Bay Area Women's Sport Initiative	Michael Imperioli	Charity: Pure Land Project"
19	9	234	8.5	Peri Peri Determined	
"19	10	235	8.3	Mother's Day	This was a special mother's day episode featuring home cooks who were mothers (making this the third amateur-centric episode of this season).	May 6, 2014	Chris Santos	Alex Guarnaschelli	Aarón Sánchez	chicken noodle soup, ground beef, spinach, salsa	tilapia fillets, plantains, crispy fruit cereal, pink grapefruit jam	passion fruit, dates, lady fingers, chocolate sauce	Samantha McLerran	ER Physician from Moss  T"
"19	11	236	9	Cool, Palm and Perfected	Despite its lethal reputation, the blowfish tails were farm-raised and did not have any poison.	May 27, 2014	Scott Conant	Maneet Chauhan	Geoffrey Zakarian	pupusas, blowfish tails, black beans, horchata liqueor	salami, date palms in brine, chicken breast, canned pumpkin	basil juice, bananas, coconut butter, Jordan almonds	David James Robinson	Executive Chef & Owner  Bezalel Gables  Hudson Valley  "
"19	12	237	8.6	There Will Be Bloody Marys	ach round had an alcoholic beverage as a basket ingredient.	June 3, 2014	Scott Conant	Alex Guarnaschelli	Marc Murphy	mille crepe cake, snow crab claws, kohlrabi, Bloody Mary	seafood paella, ground chicken, dry sherry, bread and butter pickles	cinnamon whisky, phyllo dough, Brazil nuts, rose hip jam	Millie Fernandez	Chef & Entrepreneur from Winnetka  CA	Patrick Lacey	Chef de Cuisine from Port Chester  "
"19	13	238	8.4	Four Fathers	This was a special father's day episode featuring home cooks who were fathers (making this the fourth amateur-centric episode, complementing the mother's day episode).	June 10, 2014	Scott Conant	Maneet Chauhan	Chris Santo	salt and vinegar potato chips, Dover sole fish, red Russian kale, sour cream	single malt scotch, lamb porterhouse, rapini, tamarind paste	chocolate cigars, pretzels, cocktail nuts, rice pudding	Ian-Max Henriquez	Stay-At-Home-Dad from Los Angeles  CA	Herb Hand	College Football Coach from "
"20	1	239	8.5	Dread and Breakfast	In this episode, the appetizer course was replaced with a breakfast course, the entrée with lunch, and the dessert with dinner. Chef Frohne cut himself in Round 2	March 18, 2014	Scott Conant	Chris Santos	Aarón Sánchez	coffee cake, mimosas, breakfast sausages, cream-filled chocolate eggs	John Dory fish, arugula, vodka martini, pate	prime rib, amarone wine, potato gratin, shallot confit	Rose Kai	Executive Chef  Fresh Potato Factory  "
"20	2	240	7.2	Leftovers Rescue Mission	All the baskets contained leftovers.	April 29, 2014	Chris Santos	Alex Guarnaschelli	Aarón Sánchez	leftover turkey meatloaf, leftover kimchi, leftover naan, leftover baked ziti	leftover shepherd's pie, leftover hard-boiled eggs, hot sauce packets, leftover broccoli casserole	banana pudding, leftover marmalade packets, broken crackers, leftover bacon	Chris Lukic	Chef and Owner  Bloomfield  "
"20	3	241	8.5	G'day, Chefs!	All of the basket contents had an Australian theme.	May 20, 2014	Aarón Sánchez	Chris Santos	John Li	lamb ribs, rainbow chard, loaded baked potato, cherry moonshine	emu fan fillet, Australian mustard, vegetable pasties, moonshine	canned cheddar cheese, wheat biscuit cereal, guanciale, apple moonshine	Jason "
20	4	242	8.6	Salt Pearls of Wisdom	
20	5	243	
20	6	244	
20	7	245	
"20	8	246	8.9	Big Hitters	The theme of this episode was baseball with stadium themed foods and baseball stadium chefs.	October 8, 2014	Marc Murphy	Amanda Freitag	Scott Conant	Italian sausage, tiny ice cream spheres, baby mustard greens, sunflower seeds	soft pretzels, flank steak, bleu cheese, tawny port wine	coffee caramel, popcorn, hot dog buns, blueberries	Jessica Helms	Executive Chef  St. Louis  MO  St. Louis Cardinals	Josh Distenfeld	Executive Chef  Baltimore  MD  Baltimore Orioles	Cris Vazquez	Executive Chef  Arlington  TX  Texas Rangers	James Major	Executive Chef  Cincinnati  OH  Cincinnati Reds"
20	9	247	8.2	Offal Surprise	
"20	10	248	8.9	Haricot Flair	All the contestants competing were female chefs. Chef Saylor cut herself, but did not bandage her finger because she didn't notice any blood until it was too late. The judges found blood on her plates and did not taste her dish.	October 28, 2014	Aarón Sánchez	Maneet Chauhan	Marc Murphy	fish balls, moscato, haricots verts, banana blossoms	goat chops, asafoetida, petite french lentils, quince paste	clotted cream fudge, rice crackers, rainbow sprinkles, pepper jelly	Ashlee Saylor	Sous Chef  The Silly Goose  "
20	11	249	8.2	Frankly Frantic	
20	12	250	
20	13	251	
"21	1	252	8.3	Teen Tournament: Part One	Part 1 of 5. Teenagers compete in this tournament for a spot in the finale where they would win $25,000 and a $40,000 culinary school scholarship. For the whole Teen Tournament, chefs were given 30 minutes for the appetizer round, instead of the usual 20 minutes. Alexandria cut herself in the first round.	July 15, 2014	Marc Murphy	Amanda Freitag	Geoffrey Zakarian	cherry drink soaked pickles, lamb loin chops, kale chips, riccota salata	mahi mahi, cookie snack chips, green beans, french fries	gourmet frozen yogurt sundae, white balsamic vinegar, puffed rice cereal bars, dulce de leche	Alexandria Brooks	age: 16  from Voorhees  "
"21	2	253	8.3	Teen Tournament: Part Two	Part 2 of 5.	July 22, 2014	Marc Murphy	Amanda Freitag	Geoffrey Zakarian	jumbo shrimp, chunky peanut butter, jalapeños, sticky rice	frog legs, mafaldine, bok choy, lobster mushrooms	black and white cookies, fruit leather strips, cashews, agave nectar	Mikayla Layng	age: 13  from Lynbrook  "
"21	3	254	8.2	Teen Tournament: Part Three	Part 3 of 5. Brandon cut his finger in Round 1.	July 29, 2014	Chris Santos	Alex Guarnaschelli	Alex Stupak	rabbit and ginger sausage, dandelion greens, dried currants, hot-sauce-flavored candy canes	pineapple upside-down cake, Cornish hens, hen of the woods mushrooms, edamame hummus	cinnamon cereal, pie crust, chocolate fudge sauce, grape carbonated candy	Brandon Medley	age: 15  from Sewell  "
"21	4	255	7.3	Teen Tournament: Part Four	Part 4 of 5. Morgan cut herself in the second round.	August 3, 2014	Chris Santos	Alex Guarnaschelli	Alex Stupak	salsa verde, chicken breasts, bundled lunch kits, blue corn tortilla chips	buffalo tenderloin, couscous, rainbow chard, squeezable blueberry yogurt	chocolate Swiss rolls, popcorn balls, blackberries, gummy fish	Antonio Jubela-Gordon	age: 16  from "
