season	season_episode	series_episode	episode_rating	episode_name	episode_notes	air_date	judge1	judge2	judge3	appetizer	entree	dessert	contestant1	contestant1_info	contestant2	contestant2_info	contestant3	contestant3_info	contestant4	contestant4_info
"25	2	305	8.2	Teen Tournament: Episode Two	""Part 2 of 5. Teen Chef Wenger is a protégé of Chef Joel Gargano, who competed in the fifteenth-season episode """"Cook Your Butt Off!"""" Throughout the competition Salma cut herself four times.""	September 1, 2015	Amanda Freitag	Maneet Chauhan	Scott Conant	wild langoustines, Asian long beans, yuzu juice, Japanese sweet potato	lamb shoulder, coconut milk, bok choy, dates	powdered peanut butter, ice cream sandwiches, marshmallows, curry powder	Alyssa Chacon	age 17  from Union  "
"25	3	306	7	Teen Tournament: Episode Three	Part 3 of 5. The tortilla chip lunch kit in the appetizer round included tortilla chips and some salsa.	September 8, 2015	Chris Santos	Alex Guarnaschelli	Scott Conant	vegan crispy chicken legs, golden beets, tortilla chip lunch kit, pea leaves	venison roast, butternut squash, fruity cereal macaroons, okra	walnuts in honey, assorted cookies, plums, french toast cereal	Jarren Pross	age 14  from Rebersburg  PA	Eliza McKelvey age 13	from "
"25	4	307	8	Teen Tournament: Episode Four	Part 4 of 5. The candy bars in the dessert round had the brand obscured but it appeared to be Pay Day candy bars. Veronica cut her finger in Round 1 but finished her dish.	September 15, 2015	Chris Santos	Alex Guarnaschelli	Scott Conant	spicy Italian sausage, white asparagus, habañero peppers, soup dumplings	veal chops, heirloom tomatoes, glazed doughnuts, Swiss chard	flame grapes, peanut and caramel candy bars, Greek yogurt, mango nectar	Danny Ganzman	age 15  from Buffalo Grove  IL	Olivia "
"25	5	308	8.9	Viewers' Baskets	All of the mystery ingredients were chosen by the fans via social media. Specifically: Facebook, Instagram, and Twitter.	September 17, 2015	Marc Murphy	Aarón Sánchez	Geoffrey Zakarian	rum raisin ice cream, broccoli spigarello, potato tots, potted meat	abalone, wasabi candy canes, beef jerky sticks, yellow snack cakes	banana ketchup, fruit cocktail, goat's milk, sauerkraut	Erica "
"25	6	309	8.1	Teen Tournament: Grand Finale	Part 5 of 5. The winner received a $25,000 grand prize, while the other three finalists each received a $1,000 Food "
"25	7	310	8.5	Teen Redeem	This was a redemption episode, and the first redemption episode to feature teen chefs, all four of whom were contestants in the 2014 Teen Tournament. Unlike previous teen episodes, the chefs had the usual 20 minutes in the appetizer round instead of the extended 30.	September 24, 2015	Aarón Sánchez	Maneet Chauhan	Marc Murphy	lump crab meat, daikon radish, Japanese mayonnaise, chili garlic coated peas	Korean-style short ribs, wax soda bottles, romanesco cauliflower, calzones	cold brew coffee, peanut butter toast, strawberry purée, Italian milk cookies	Morgan Goldstein	age 15  from Cleveland  OH	Dante Foggy	age 18  from Burlington Township  "
"25	8	311	8.7	Sitcom Moms	This was a celebrity episode featuring four actresses who played sitcom moms, all of them competing for charity. The TV dinners in the appetizer round included turkey, stuffing, and mashed potatoes. Betsy Randle accidentally left a piece of plastic in a round 1 dish, then forgot an ingredient in round 2, leading to her ultimately getting eliminated in the final round. (She got through the first two rounds because Jo Marie's dishes were inconsistently cooked and loaded with raw spices, while Tichina didn't transform her ingredients enough).	September 29, 2015	Chris Santos	Amanda Freitag	Geoffrey Zakarian	TV dinners, portobello mushrooms, fresh spinach, sour cream	minute steak, rainbow carrots, cream of celery soup, french toast	tiramisu, bananas, strawberry sauce, almonds	Jo Marie Payton	Family Matters  charity: Grandparents Taking Care of Grandchildren	Tichina Arnold	Everybody Hates Chris  charity: We Win Foundation	Betsy Randle	Boy Meets World  charity: "
"25	9	312	8.6	Bizarre Battle	""The baskets featured """"bizarre"""" ingredients. Chef Morris works for Iron Chef Jose Garces.""	October 8, 2015	Marcus Samuelsson	Marc Murphy	Scott Conant	duckbills, young jackfruit in brine, hand-pulled noodles, fruit-flavored beef jerky	pork bung, hot sauce jelly beans, farro, pork dust	smen, aloe mango pudding, warka pastry sheets, poi	Katie Wentworth	Executive Sous Chef from Seattle  WA	Lucerno Martinez Obregon	Executive Chef from "
"25	10	313	8.1	Oktoberfest!	The basket ingredients were inspired by Oktoberfest. The schnitzel was made of pork. The beer keg contained Kölsch.	October 13, 2015	Geoffrey Zakarian	Maneet Chauhan	Edi Frauneder	sülze, sauerkraut, German soft pretzels, beer cheese soup	schnitzel, mittelscharf, turnips, keg of beer	chocolate sausage, spätzle, blackberries, bock beer	Ivan Giani	Executive Chef from "
"25	11	314	8.9	Thanksgiving Soup-er Stars	This was a Thanksgiving episode featuring four soup kitchen chefs. Each basket contained the same ingredients, but in different forms. Each chef's respective soup kitchen received a donation from Food "
25	12	315	8.6	Cooking with Bass	
"25	13	316	8.8	Mac and Cheese	Mac and cheese was the theme of the competition, with a version of the main mac & cheese ingredients found in every basket.	December 1, 2015	Maneet Chauhan	Alex Guarnaschelli	Aarón Sánchez	mac and cheese, Canadian bacon, swiss chard, monkfish	pasta shells, chorizo, spring peas, rotisserie chicken	rigatoni, white chocolate, roasted figs, mac and cheese ice cream	Matt Jozwiak	Research & Development Chef from "
"26	1	317	7.3	A Chopped Halloween	""This was a Halloween themed episode. The coffin toast in the entree round consisted of a toasted bread boat filled with seafood and a cream sauce. In Round 2 Celinda forgot the pickled pigs lips and she also cut herself using the same cutting board side she used and there was blood on her dish and the judges did not taste it resulting in her elimination. The """"boo-nilla"""" shakes in the dessert round were vanilla milkshakes.""	October 6, 2015	Aarón Sánchez	Alex Guarnaschelli	Geoffrey Zakarian	gory ribs, broccoli rabe, blood soup, mozzarella eyeballs	lobster, pickled pigs lips, squid ink pasta, coffin toast	Day of the Dead cookies, watermelon brain, chocolate covered bugs, boo-nilla shakes	Jeny Weimer	Executive Chef & Co-Owner from "
"26	2	318	8.1	Chopped Catwalk	All of the contestants are models as well as professional chefs.	October 15, 2015	Marc Murphy	Marcus Samuelsson	Maneet Chauhan	tuna in a bag, gazpacho, finger limes, kale chips	sea bass, veggie tray with hummus, avocados, chia seeds	strawberry lemonade, butter crackers, coconut fruit pops, cape gooseberries	Din Yates	Model/Chef & Restaurateur from "
"26	3	319	8.6	Food Truck Kitchen	All of the competitors in this episode owned food trucks.	October 27, 2015	Scott Conant	Maneet Chauhan	Geoffrey Zakarian	bao buns, cracklings, duck sauce, gyros	bibimbap, rainbow chard, fresh chickpeas, footlong hot dogs	doughnuts, green apricots, cocoa hazelnut spread, ice cream bars	Franky Karagiorgos	Chef and Co-Owner from "
26	4	320	8.6	Military Vets	All contestants are veterans of the United States Military Services.	
"26	5	321	8.6	Chopped Desserts!	Four pastry chefs competed in this episode where all 3 rounds were dessert rounds. Each round focused on a different dessert: chocolate, candy, and cake. The 1st round was extended to 30 minutes instead of the usual 20 minutes. The 3rd round was 60 minutes instead of 30 to allow the chefs enough time to bake and decorate their cakes.	"
"26	6	322	8.1	In-Laws, in Teams!	Teams of two amateur cooks, each consisting of a mother-in-law (MIL) and her daughter-in-law (DIL), competed in this episode. The wine purse in the first round contained white Bordeaux. The imitation sunny-side up eggs in the second round were made from tofu and soy.	December 10, 2015	Amanda Freitag	Alex Guarnaschelli	Maneet Chauhan	lasagna, arugula, onion blossom chips, wine purse	brisket, imitation sunny-side up eggs, mashed potatoes, leeks	monkey bread, feijoa, cream cheese, orange blossom water	Ada Santa	MIL & Jaime Santa  DIL  from "
"26	7	323	8.2	Family Affair	This is the second time all four contestants were family members that work at the same family restaurant.	December 15, 2015	Geoffrey Zakarian	Maneet Chauhan	Marc Murphy	pork roll, baby eggplant, pizza dough, Chinese spaghetti sauce	chicken breasts, tzatziki, stinging nettles, cornbread stuffing	cassata cake, white chocolate chips, blood orange crackers, pine nuts	Ryan Profetto	Heather's son  College Student from Milford  CT	John Profetto	Heather's husband  Business Manager & Co-Owner from Milford  CT	Kate Campbell	Heather's sister  Chef de Cuisine from Milford  CT	Heather Profetto	Chef & Co-Owner from Milford  CT"
"26	8	324	8.5	Battle of the Grandpas	All competitors were amateur cooks and grandfathers. The contestants were given 30 minutes in the appetizer round instead of the usual 20. Gary Stamm is the father of former Chopped contestant April Stamm.	December 17, 2015	Aarón Sánchez	Maneet Chauhan	Chris Santo	bologna, mango salsa, frozen hashbrowns, maple egg cream	London broil, rutabaga, broccoli rabe, peanut butter taffy bites	strawberry pretzel pie, kiwi, chocolate milk powder, orange-flavored liqueur	Artie Wachtel	Retired Sales Manager from "
"27	1	325	8.5	Knife Strife	""Guest judge Christian Petroni was a former Chopped champion (Episode 4.5 – """"Mussels Mastery & Cotton Candy Can-Do"""") and Chopped tournament competitor (Episode 5.7 - """"$50,000 Tournament: Round Four"""").""	January 5, 2016	Christian Petroni	Alex Guarnaschelli	Chris Santo	arancini, blood sausage, lemongrass, ajo dulce	porchetta, popcorn on the cob, okra, crema catalana	lardo, smoked maple syrup, pizza dough, tartufo	Gary Ly	Sous Chef from Houston  TX	Dawn Burrell	Line Cook from Houston  TX	Jason Kerr	Chef & Food Sourcer from Houston  TX	Raffaele Ronca	Chef & Restaurateur from "
"27	2	326	8.7	Healthy Rivalry	Contestants were asked to cook healthy, nutritious, and lighter dishes, with nothing too fatty or heavy.	January 12, 2016	Geoffrey Zakarian	Maneet Chauhan	Scott Conant	beets, 100-calorie almond pack, cauliflower pizza crust, Chilean sea bass fillets	bone broth, teff, edamame noodles, grass-fed beef strip loin	ghee, coconut sugar, guava, chickpea flour	Aviv Regev	Private Chef from "
"27	3	327	8.7	Brunch Battle	Contestants were asked to make brunch-themed dishes.	January 19, 2016	Aarón Sánchez	Alex Guarnaschelli	Chris Santo	smoked whitefish, deviled quail eggs, biscuits, bloody mary	duck eggs, (whole) chicken, waffles, mimosa	farm fresh eggs, cappuccino, Concord grape doughnuts, poached pears	"
27	4	328	9.1	Chinese 
"27	5	329	7.7	Tailgate Party	The theme of this episode was tailgating; the baskets were replaced by coolers. The contestants were amateur cooks and experienced tailgaters. Instead of the traditional chefs coats, the contestants wore specially made Chopped football jerseys.	February 2, 2016	Aarón Sanchez	Chris Santos	Eddie Jackson	quinoa burgers, deep-fried bacon, screwdriver, hoagie dip	bratwurst, shredded cheddar, beer, grilled corn	corn chip bars, rum & cola, blackberries, bananas	Kirk Bronsord	from Oakland  CA	"
"27	6	330	7.9	Bacon Boys	""This was a bacon-themed episode, featuring bacon in every basket. The """"bacon"""" gummies in the third round were strawberry gummies. All the chefs were males and wore specially made bacon T-shirts and blue jean aprons instead of the chefs coats.""	February 7, 2016	Scott Conant	Maneet Chauhan	Chris Santo	slab bacon, baby turnips, bacon-flavored popcorn, banana jam	ham hock, dandelion greens, bacon ice cream, back bacon	""""""bacon & egg"""" gummies, figs, chicharron, lardo""	"
"27	7	331	8.2	Love Bites	This episode had a theme of love, with each basket containing one or more ingredients believed to be aphrodisiacs.	February 9, 2016	Geoffrey Zakarian	Alex Guarnaschelli	Scott Conant	oysters, avocados, chocolate-covered strawberries, whipped cream vodka	figs, mead, asparagus, bone-in rib eye	chocolate mousse, eclairs, pomegranates, port wine	Mark Bailey	Private Chef from "
"27	8	332	8.1	Ready for Redemption	very contestant was a former runner-up seeking redemption.	February 16, 2016	Chris Santos	Maneet Chauhan	Geoffrey Zakarian	pig snouts, fava beans, teething biscuits, strawberry daiquiri jam	cheesecake, leg of lamb, garam masala, bitter melon	cocoa nibs, durian paste, raspberries, coconut milk	Gilbert Delgado	""Episode 20.12 – """"Chopped Chops""""""	Danika Brysha	""Episode 26.2 – """"Chopped Catwalk""""""	Anastacia Song	""Episode 22.8 – """"Late "
"27	9	333	8.3	Cooking Caribbean	This was a Caribbean themed episode. Contestants were asked to create Caribbean-inspired dishes and each basket contained Caribbean ingredients. During the entrée round, contestants were given a hammer to open the coconut. The callaloo greens in the entrée round appeared to be the variety from taro leaves.	February 23, 2016	Aarón Sanchez	Tino Feliciano	John Suley	shrimp, papaya, canned spiced ham, mofongo	goat chops, chickpeas, callaloo, whole coconuts	sugarcane, mangoes, sweet potatoes, rum	Keisha Bocage	Chef & Owner from Houston  TX	Rocco "
"27	10	334	8.1	Truck Stop Stars	very contestant was a chef at a truck stop.	March 1, 2016	Amanda Freitag	Chris Santos	Aarón Sanchez	red-eye gravy, fennel, black garlic, meatloaf mix	grits, cola, purple cauliflower, cube steak	french fries, cactus pears, apple pie, bacon	Jake Harbeck	Chef from Walcott  IA	Shaun Yazbek	Executive Chef from Bangor  ME	Eva Dix	Chef & Co-Owner from McLean  IL	J.R. Tiger	Chef from Harrisburg  PA"
"27	11	335	7.8	Beg, Borrow or Eel	"
"27	12	336	7.6	Chopped: College	very contestant was an amateur cook and college undergraduate.	March 15, 2016	Chris Santos	Alex Guarnaschelli	Maneet Chauhan	rice & beans, chicken cutlets, tomato soup, energy drink	coffee, Brussels sprouts, frozen mac & cheese, skirt steak	chocolate hazelnut spread, graham cracker cereal, rambutans, lime gelatin shots	Danielle Wilk	from Rutgers University in "
"27	13	337	8.8	The Bold and the Baconful	""very contestant was a """"street food chef"""" from Houston, Texas.""	March 17, 2016	Chris Santos	Marcus Samuelsson	"
"28	1	338	8.4	Chopped Champions: Battle 1, Best of the Best	First episode of a five-part tournament. Four returning champions compete for a spot in the tournament finale. The beer flight in the second round contained four different types of beer.	March 29, 2016	Aarón Sánchez	Maneet Chauhan	Marc Murphy	soft pretzels, green romano beans, papaya, pig ears	grouper, frilly mustard greens, bread cheese, beer flight	curry cooking sauce, lady apples, coconut brittle, baby artichokes	Stacey Givens	""Episode 22.13 – """"Scoops On!""""""	Daniel Sharp	""Episode 23.1 – """"Every 'Wich Way""""""	Elderoy Arendse	""Episode 20.13 – """"Pesto Chango""""""	Meny Vaknin	""Episode 22.11 – """"Hot Stuff""""  advances to final round"""
"28	2	339	8.4	Chopped Champions: Battle 2, Fighting Shape	Second episode of a five-part tournament. While Chopped normally obscures brand names, the smoked sausage in the first round was a product of Chopped sponsor Hillshire Farms. The frozen yogurt in the first round was not flavored.	April 5, 2016	Aarón Sánchez	Alex Guarnaschelli	Marcus Samuelsson	smoked sausage, cavatappi, "
"28	3	340	8.4	Chopped Champions: Battle 3, Chefs in Control	""Third episode of a five-part tournament. Guest judge Christian Petroni was a former Chopped champion (Episode 4.5 – """"Mussels Mastery & Cotton Candy Can-Do"""") and Chopped tournament competitor (Episode 5.7 - """"$50,000 Tournament: Round Four"""").""	April 12, 2016	Geoffrey Zakarian	Chris Santos	Christian Petroni	chicken livers, cinnamon whiskey, edamame, grape licorice	duck breasts, harissa, pear frangipane tart, orange sherbet	bison jerky, sour cream, freeze-dried blueberries, egg waffles	Raffaele Ronca	""Episode 27.1 – """"Knife Strife""""""	Mo Major	""Episode 23.7 – """"T.G.I. Fry-Day""""""	Roro Morales	""Episode 22.1 – """"Mummies and Gummies""""""	Deborah Caplan	""Episode 25.10 – """"Oktoberfest!""""  advances to final round"""
"28	4	341	8.6	Chopped Champions: Battle 4, Kitchen Storm	""Fourth episode of a five-part tournament. Contestants Adam and Jackie Sappington had previously won a couples' team competition episode, but competed individually in this episode. Guest judge Angie Mar was the winner of the second Chopped: Grill Masters tournament (Special 11 - """"Grill Masters: Episode Five""""). The duck mousse in the third round contained duck liver and port wine.""	April 19, 2016	Aarón Sánchez	Alex Guarnaschelli	Angie Mar	stone crab claws, butterfly leaves, vanilla frosting, peach-strawberry salsa	rack of wild boar, dried spicy mango, baby kale, piña colada	saffron, honeycomb, duck mousse, sea beans	Silvia Baldini	""Episode 23.10 – """"Fake Cake  Real Stakes""""""	Adam Sappington	""Episode 23.6 – """"Double Trouble""""""	Jackie Sappington	""Episode 23.6 – """"Double Trouble""""""	Andre Fowles	""Episode 27.9 – """"Cooking Caribbean""""  advances to final round"""
"28	5	342	8.2	Chopped Champions: Conclusion, $50,000 Pay Day	""Fifth episode of a five-part tournament. Guest judge Angie Mar was the winner of the second Chopped: Grill Masters tournament (Special 11 - """"Grill Masters: Episode Five"""").""	April 26, 2016	Amanda Freitag	Scott Conant	Angie Mar	Mangalitsa pork burgers, chow mein noodles, tardivo, blood clams	leg of lamb, blue cheese lollipops, cognac, cardoons	chocoflan, satsuma mandarin, smoked almonds, caramelized onions	Meny Vaknin	""Episode 22.11 – """"Hot Stuff""""""	Deborah Caplan	""Episode 25.10 – """"Oktoberfest!""""""	Andre Fowles	""Episode 27.9 – """"Cooking Caribbean""""""	Adam Greenberg	""Episode 22.8 – """"Late "
"28	6	343	8.6	Cinco de Mayo Fiesta	This was a Cinco de Mayo themed episode and contestants were asked to cook Mexican cuisine. The piñata in the third round contained assorted candies including caramel squares, strawberry hard candy, and round peppermints.	May 3, 2016	Aarón Sánchez	Amanda Freitag	Ulrich Koberstein	margarita pie, nopales, masa dough, mahi mahi	corn cookies, Mexican-style cheese blend, jicama, beef barbacoa	piñata, black beans, crema, Mexican hot chocolate	Artist Thornton	Executive Chef from East Harlem  "
28	7	344	8.5	Tortellini Trials	
"28	8	345	7.9	Hungry for Love	This was a team competition, with each team consisting of two amateur cooks meeting for the first time as blind dates. The episode focused not only on the cooking, but also on how well the dates got along.	May 17, 2016	Marcus Samuelsson	Maneet Chauhan	Christian Petroni	scallops, dirty martini, Buddha's hand, dates	veal chuck roast, bucatini pasta, honeynut squash, chocolate lips	rose bud tea, chocolate honeycomb candy, crème anglaise, mangosteens	Peter Endrigian and Sally Meehan	Actor/Maitre'd from "
"28	9	346	8.2	Summer Heat	""In this episode, each basket contained ingredients associated with summertime. Chef Kave is the sister of former Chopped champion and Chopped tournament competitor Corwin Kave. The sand castle cake in the first round was pound cake with a graham cracker """"sand"""". The clambake in the second round contained mussels, steamer clams, potatoes, corn, and seaweed.""	May 24, 2016	Aarón Sánchez	Maneet Chauhan	Geoffrey Zakarian	lobster, zucchini, cucumber pineapple cooler, sand castle cake	clambake, fresh chickpeas, potato chips, rainbow chard	fruit kabobs, iced tea, whipped topping, ice cream sandwiches	Dean Barker	Sous Chef from "
"28	10	347	7.1	Deadliest Baskets	ach basket featured dangerous ingredients, some deadly if prepared improperly. The 'shark' in the dessert round was a watermelon carved to look like a shark.	May 31, 2016	Marc Murphy	Aarón Sánchez	Marcus Samuelsson	rattlesnake, cherimoya, rhubarb, ghost pepper	alligator, absinthe, oysters, delicata squash	huitlacoche, nutmeg, butterscotch beer, 'shark'	John Beatty	Executive Chef from "
28	11	348	7.9	Chopping Block Blues	
"28	12	349	8.6	San Franchopco	All four chefs are from the San Francisco Bay area. Baskets each featured one or more San Francisco-themed ingredients.	June 14, 2016	Scott Conant	Maneet Chauhan	Chris Santo	garlic fries, pea tendrils, shishito peppers, mission style burritos	California common beer, Chinese okra, quince, quail	Irish coffee, sourdough bread bowl, California pomegranates, chocolate bars	Mariko Wilkinson	Farm Chef from Marshall  CA	Sean Thomas	Chef de Cuisine from San Francisco  CA	Emily Hansen	Private Chef from San Francisco  CA	Joe Sasto	Sous Chef from San Francisco  CA"
"28	13	350	7.8	Leap of Faith	All four contestants were amateur cooks and religious leaders. The baskets featured one or more biblical-themed or religious-themed ingredients. Rabbi Hecht is strictly kosher and therefore could not cook meat and dairy in the same competition. To accommodate this, the baskets kept kosher, and the pantry was stocked with dairy substitutes such as margarine and non-dairy whipping cream.	June 21, 2016	Marc Murphy	Alex Guarnaschelli	Geoffrey Zakarian	salmon, spring onions, raw white honey, Ezekiel bread	lamb shoulder steaks, quince, cerignola olives, kosher wine	figs, rainbow carrots, macadamia nuts, hamantaschen	Father Justin Matro	Benedictine Monk & Pastor from Crabtree  PA	Sister Sara Marks	Franciscan "
"29	1	351	8.5	Fried Chicken Time	The theme of this episode was fried chicken with chicken of some kind in every basket. The deep-fryer was turned off, and each chef was given a pre-heated pot of oil on their station. Chef Reynolds' wife is Chopped Champion Janelle Reynolds.	August 7, 2016	Marc Murphy	Amanda Freitag	Craig Samuel	half-roasted chicken thighs, scallion pancakes, kimchi, cherry cola sundae sauce	whole brined chickens, pimento cheese, okra, peach cobbler	chicken skin, "
29	2	352	8.9	Snail Snafus	
"29	3	353	8.4	Hot Doggin'	The theme for this episode was hot dogs, and all three baskets contained hot dogs in some form. In Round 1, Chef Carter forgot carrot ketchup in his dish, but moved on as the judges cited Chef Cain's dish not tasting as good, as the reason for his elimination. In Round 2, Chef Carter and Chef Zavala both forgot quail eggs in their dishes, but Chef Zavala moved on as the judges cited Chef Carter's repeating his mistake from Round 1, as the reason for his elimination. This episode also marks the first time where two chefs forgot the same basket ingredient in their dishes in the same round.	August 14, 2016	Marc Murphy	Alex Guarnaschelli	Amanda Freita	alpaca hot dogs, sauerkraut, carrot ketchup, pâté	wagyu beef hot dogs, quail eggs, watermelon radishes, canned chili	corn dogs, coffee toffee, chocolate-covered jalapeños, deep-fried cookie dough	Cameron Cain	Executive Chef from Houston  TX	Seth Carter	Chef de Partie from San Francisco  CA	Rey Martinez	Executive Chef from Brooklyn  "
29	4	354	7.4	Souper Chefs	
"29	5	355	8.3	Chili Cook-Off	The chefs were required to create chili-themed dishes in each round.	August 21, 2016	Aarón Sánchez	Amanda Freitag	Maneet Chauhan	pork cheek, kohlrabi, Mexican chocolate, chorizo	boneless short ribs, spicy gummy peppers, choclo, smoked turkey wings	jalebi, sweet/spicy cocktail sugar, habichuelas con dulce, roasted red peppers	Jim Angelus	Chef & Restaurateur from San Francisco  CA	"
"29	6	356	7.8	Teen Tournament: Battle 1	Part 1 of a 5-part tournament featuring teenage cooks. For the whole tournament, the first round is 30 minutes instead of the usual 20.	August 23, 2016	Scott Conant	Alex Guarnaschelli	Geoffrey Zakarian	waffle tacos, yogurt covered pretzels, broccolini, speck	capon, purple cabbage, ranch dressing, pizza casserole	banana split brownies, avocados, ribbon candy, wasabi peanuts	"
"29	7	357	7.7	Teen Tournament: Battle 2	Part 2 of a 5-part tournament featuring teenage cooks.	August 30, 2016	Scott Conant	Marc Murphy	Aarón Sánchez	saucisson en croute, quinoa, white harissa, seaweed salad	squid, lemon candy, Kusa Squash, shrimp cocktail	French pastries, citrus soda, strawberries, pirate's breakfast (eggs and bacon)	"
"29	8	358	7.6	Teen Tournament: Battle 3	Part 3 of a 5-part tournament featuring teenage cooks.	September 6, 2016	Scott Conant	Maneet Chauhan	Aarón Sánchez	Korean short ribs, apple green tea coolers, Brussels sprouts, Gorgonzola dulce	Skate wing, rainbow pasta, bok choy, Giardiniera	Pate a choux, cherry tomatoes, balsamic jelly, chocolate milk	Brittany Matteson	age 17  from Boyertown  PA	Mukanjo Mukuka	age 17  from Valley Stream  "
"29	9	359	7.9	Twins for the Win	This was a team competition featuring four teams of twin chefs. Aaron Sanchez' twin brother Rodrigo Sanchez made an appearance during the dessert round.	September 8, 2016	Aarón Sánchez	Alex Guarnaschelli	Marc Murphy	double-yolked eggs, pickled pork skins, broccoli rabe, crawfish tails	peas in a pod, crown roast of pork, root beer float, Japanese sweet potatoes	ya pears, fennel pollen, pate sucree, Brazil nuts	Tammy Lakatos-Shames & Lyssie Lakatos	"
"29	10	360	8	Teen Tournament: Battle 4	Part 3 of a 5-part tournament featuring teenage cooks.	September 13, 2016	Scott Conant	Alex Guarnaschelli	Amanda Freita	porcini mushrooms, verjus, linzer torte cookies, rabbit in a can	bison skirt steak, snap peas, guanciale, chocolate-covered potato chips	seedless red grapes, building block candy, bee sting cake, sparkling cider	Jeffrey Heilman	age 18  from San Jose  CA	Jonas Park	age 16  from Ardsley  "
29	11	361	8.4	
"29	12	362	7.9	Teen Tournament: Finale Fight	Final part of a 5-part tournament featuring teenage cooks. The four remaining teen chefs competed for a $25,000 grand prize. The other three finalists each received a $1,000 Food"
