season	season_episode	series_episode	episode_rating	episode_name	episode_notes	air_date	judge1	judge2	judge3	appetizer	entree	dessert	contestant1	contestant1_info	contestant2	contestant2_info	contestant3	contestant3_info	contestant4	contestant4_info
"1	1	1	9.2	Octopus, Duck, Animal Crackers	This is the first episode with only three official ingredients in a basket (dessert round). There would be no hard set limit until season 4.	January 13, 2009	Marc Murphy	Alex Guarnaschelli	Aarón Sánchez	baby octopus, bok choy, oyster sauce, smoked paprika	duck breast, green onions, ginger, honey	prunes, animal crackers, cream cheese	Summer Kriegshauser	Private Chef and "
"1	2	2	8.8	Tofu, Blueberries, Oysters	This is the first of a few episodes with five official ingredients in a basket (entrée round), as well as three ingredients in the appetizer round.	January 20, 2009	Aarón Sánchez	Alex Guarnaschelli	Marc Murphy	firm tofu, tomato paste, prosciutto	daikon, pork loin, "
"1	3	3	8.9	Avocado, Tahini, Bran Flakes	"
"1	4	4	8.5	Banana, Collard Greens, Grits	In the appetizer round, Chef Chuboda refused to use bananas in his dish, leading to his elimination. In the dessert round, Chef Gonzales accidentally used salt instead of sugar in his dish, asserting that this resulted in his elimination.	February 3, 2009	Scott Conant	Amanda Freitag	Geoffrey Zakarian	ground beef, wonton wrappers, cream of mushroom soup, bananas	scallops, collard greens, anchovies, sour cream	maple syrup, black plums, almond butter, walnuts, quick grits	Sean Chudoba	Executive Chef  Ayza Wine Bar  "
"1	5	5	8.8	Yucca, Watermelon, Tortillas	"
"1	6	6	8.5	Canned Peaches, Rice Cakes, Beets	"
"1	7	7	8.8	Quail, Arctic Char, Beer	In the appetizer Melinda did not get her quail on 1 plate. As a result, she was eliminated.	February 24, 2009	Scott Conant	Alex Guarnaschelli	Amanda Freita	endive, frozen peas, quail, red seedless grapes	watercress, tamarind paste, creamed corn, Arctic char	pitted dates, frozen pie crust, caramel candy, stout beer	Melinda Dorn	Sous chef and Instructor  "
"1	8	8	9	Coconut, Calamari, Donuts	In the appetizer round, Chef LePape failed to get any food onto his plates. The judges allowed him to bring the pan from the oven to the tasting table after the other competitors offered their permission. Despite this, Chef LePape was eliminated.	March 3, 2009	Aarón Sánchez	Alex Guarnaschelli	Chris Santo	turbot, nori sheets, pistachios, coconut	rainbow chard, papaya, granola, parsnips, calamari	plain donuts, smoked gouda, white chocolate, dried apricots	Gwen LePape	Executive Chef  Frederick's Restaurant  "
"1	9	9	8.9	Mac & Cheese, Cola, Bacon	Chef Lustberg has also competed on the ninth season of Hell's Kitchen (U.S. season 9).	March 10, 2009	Chris Santos	Amanda Freitag	Marc Murphy	boxed macaroni and cheese, artichokes, tilapia	eggplant, ground pork, poblano chiles, avocados, cola	oranges, grapefruit, semi-sweet chocolate chips, bacon	David Goldwhite	Private Personal Chef  "
"1	10	10	8.8	String Cheese, Jicama, Gingersnaps	This is the first episode to feature four male chefs.	March 17, 2009	Scott Conant	Amanda Freitag	Geoffrey Zakarian	chicken wings, soba noodles, celery, string cheese	striped bass, pimento peppers, jicama, mangoes, brie cheese	ginger snaps, crème fraîche, instant coffee, carrots	Jonathan Jernigan	Executive Chef  Catering by Jonathan  Willingboro  "
"1	11	11	8.8	Jumbo Shrimp, Pepperoncini, Cereal	"
"1	12	12	9.1	Chocolate, Mussels and Figs	"
"1	13	13	9.2	Strawberries, Turkey and Gummi Bears	"
"2	1	14	8.7	A Prickly Situation	The judges caught Chef Lemoine plating past time limits. As a result, the judges eliminated him.	June 14, 2009	Aarón Sánchez	Alex Guarnaschelli	Chris Santo	brioche, fennel, sea urchin	blackstrap molasses, red snapper, parsley root, dried cranberries	bulgur wheat, pomegranate juice, pineapple, green papaya	Peter Klein	Executive Chef and Part Owner  Chow Bar  "
2	2	15	8.8	Salty Veggies & Heated Battles	
"2	3	16	8.6	High Hopes	Chef Puzio did not finish her plates in Round 1 resulting in her elimination. The judges also were very disappointed in every first course. The bison in the second basket was a thick-cut sirloin steak.	June 23, 2009	Scott Conant	Amanda Freitag	Marc Murphy	calamari, Brussels sprouts, Asian pears	bison, dried mango, leeks, Belgian-style ale	ancho chiles, semi-sweet chocolate, black plums	"
2	4	17	8.7	Floundering Around	
"2	5	18	8.8	Pride on the Plate	Throughout each course, Chef Matarese failed to complete any of his dishes. Chef Mansukhani went on to compete on the tenth season of Hell's Kitchen (under the surname 'Gurnani').	July 7, 2009	Chris Santos	Alex Guarnaschelli	Marc Murphy	duck breast, polenta, sharon fruit	rainbow trout, baby turnips, tamarind concentrate, serrano ham	sliced almonds, Okinawan sweet potatoes, brioche, sambuca	Shaya Klechevsky	Personal Chef and Instructor  At Your Palate  "
2	6	19	8.6	Pretty Please with a Pepper on Top	
"2	7	20	8.7	Pods, Grills and Sticky Fingers	Chef Orchid got eliminated in the Appetizer for only getting shrimp on 1 plate and forgetting to plate the raisins.	July 28, 2009	Scott Conant	Amanda Freitag	Geoffrey Zakarian	jumbo shrimp, edamame, golden raisins	flank steak, grape juice, goat cheese, lemongrass	coffee liqueur, avocados, boiled ginkgo nuts, honeycomb	Moha Orchid	Private Chef  "
2	8	21	8.6	A Wish Upon A Starfruit	
"2	9	22	8.7	Buckwheat Blunders and Twists of Fate	Chef Amitzur cut himself in Round 1 and continued making his dish with no gloves, or band-aid however the producer made him throw his dish away forcing him to redo his dish.	August 25, 2009	Chris Santos	Alex Guarnaschelli	Aarón Sánchez	olive oil packed tuna, English cucumbers, buckwheat flour	knockwurst, pretzels, ramps, mangosteen	biscuit dough, pistachios, dried hibiscus flowers, black olives	Simon Lange	Chef and Restaurateur  Apartment 138  Brooklyn  "
"2	10	23	9	Chopped Champions Event, Round One: The Ultimate Face-off	""This is the first """"Chopped Champions"""" event, featuring winners of past episodes. There were four loosely connected parts, wherein the winner of this episode got $10,000 and the chance to compete in the next special episode against three new past champions, potentially winning up to $40,000 with each round they get through.""	September 8, 2009	Geoffrey Zakarian	Alex Guarnaschelli	Marc Murphy	crayfish, red seedless grapes, fiddlehead ferns	quail, guava nectar, udon noodles, dinosaur kale	baby kiwi, Israeli couscous, rice paper, saffron	Michael Carrino	""Chef and Owner  Restaurant Passionné  Montclair  "
"2	11	24	8.9	Chopped Champions Event, Round Two: Best of the Best	Three new Chopped champions competed against the winner of the Chopped Champions Event, Round One. The winner of this episode got $10,000 and the chance to compete in the next episode against three different past champions. The previous winner lost in the dessert basket, meaning a new chef got the chance to potentially add more money to their winnings in the next special episode (up to $30,000).	September 15, 2009	Scott Conant	Jody Williams	Aarón Sánchez	cockles, kohlrabi, pita bread	ground chicken, green tea leaves, mustard oil, braeburn apples	chocolate wafers, manchego cheese, passionfruit, goji berries	Pippa Calland	""Owner and Chef  Chef for Hire LLC  "
"2	12	25	9	Chopped Champions Event, Round Three: All-Stars Showdown	Three new Chopped champions competed against the winner of the Chopped Champions Event, Round Two. The winner of this episode got $10,000 and the chance to compete in the next episode against three different past champions. Once again, the previous winner got knocked out (in the entrée basket) so a new chef got the chance to potentially add more money to their winnings in the next special episode (up to $20,000).	September 22, 2009	Chris Santos	Geoffrey Zakarian	Marc Murphy	lavash bread, preserved lemons, squab	bluefish, papaya, ginger snaps, beef jerky	butter crackers, grapefruit, feta cheese, gin	Jackie Lee	""Private Chef  "
"2	13	26	9.1	Chopped Champions Event, Round Four: Bring It!	This is the last of the special Chopped Champion Event episodes. Three Chopped champions competed against the winner of the Chopped Champions Event, Round Three. A new champion dethroned the previous winner in the appetizer round meaning none of the winners in all four episodes won more than one episode. The winner of this episode got $10,000.	September 29, 2009	Scott Conant	Alex Guarnaschelli	Aarón Sánchez	lobster, bananas, endive	pork loin, watercress, galia melon, taro root	matzo, pomegranate molasses, roasted chestnuts, baby fennel	Cody Utzman	returning champion	Diane DiMeo	""Private Chef  Red Box Bistro  "
3	1	27	8.2	When Chefs Collide	
"3	2	28	8.6	Oh My Goshy, Umeboshi	Chef Esmonde cut herself during the entrée round. After attempting to put on a glove that did not fit, she took it off and tossed her salad with her hands despite her open wound. As a result, the judges did not eat the salad and chopped her for her poor sanitation. Chef Baruch is a sous chef for semi-regular Chopped judge Sue Torres.	October 20, 2009	Aarón Sánchez	Jody Williams	Geoffrey Zakarian	peas, peaches, eel	shrimp, oatmeal, butternut squash, umeboshi	parsnips, limoncello, soda crackers, sharp cheddar cheese	Jeffrey Baruch	Executive Chef  London Lennie's Seafood Restaurant  "
"3	3	29	8.4	Judge Knows Best	Chef Dobias did not get his plantain cake on the plate in the dessert round despite getting all 4 ingredients on the plate. The judges offered he could bring up his cakes. However his competitor had to offer his consent and said no. Despite this Chef Dobias won due to the mistakes his opponent made throughout the meal.	October 27, 2009	Chris Santos	Scott Conant	Marc Murphy	hamachi, quail eggs, dried cherries	beef tenderloin, mango, gruyère cheese, kochujang	ripened plantains, prosecco, crystallized ginger, bacon	Fabian Ludwig	Executive Chef  Gramercy Park Hotel  "
3	4	30	8.6	A 
3	5	31	8.6	Sticking To It	
"3	6	32	8.6	Season's Choppings	The chefs were given 45 minutes in the entrée round rather than the normal 30 to allow time to properly cook the turkey.	December 8, 2009	Scott Conant	Alex Guarnaschelli	Aarón Sánchez	venison tenderloin, quince, eggnog	kale, rutabaga, marshmallows, turkey	garnet yams, brie, sparkling wine, cranberries	Megan Fells	Chef and Restaurateur  The Artist's Palate  Poughkeepsie  "
3	7	33	8.9	Flower Power	
"3	8	34	9	Sweet Redemption	This was the first episode to feature four past runners-up competing for a chance to redeem themselves and win.	March 21, 2010	Aarón Sánchez	Scott Conant	Marc Murphy	littleneck clams, Yukon Gold potatoes, rhubarb	striped bass, corn tortillas, applesauce, okra	carrot juice, white chocolate chips, baby beets, hominy	Michael Giletto	""Executive Chef  Cherry Valley Country Club  Skillman  "
3	9	35	8.6	Winging It	
"3	10	36	8.6	In A Pinch	This was the first episode where two female chefs faced each other in the final round.	April 5, 2010	Scott Conant	Alex Guarnaschelli	Marc Murphy	red cherry peppers, mortadella, soft shell crabs	baby bananas, black-eyed peas, poblano chiles, ostrich steak	lychees, phyllo dough, Canadian bacon, candy canes	Damien Brassel	Executive Chef  Knife + Fork  "
3	11	37	8.5	Raw Enthusiasm	
"3	12	38	8.5	Against the Tide	This was the first episode to feature an ingredient, violet mustard, that the judges were not familiar with.	April 19, 2010	Mark Bittman	Amanda Freitag	Aarón Sánchez	habanero chiles, bittersweet chocolate, fresh sardines	strawberries, celery root, lamb loin chops, Swiss cheese	corn tortillas, dried chipotle peppers, blueberries, violet mustard	Michael Madigan	Chef and Restaurateur  Snails and Quails / Farm 2 Bistro  "
3	13	39	8.5	Chopped Liver	
"4	1	40	8	Rattle & Roll	Siggy only managed to make 1 plate in the first round resulting in her elimanation.	April 6, 2010	Chris Santos	Alex Guarnaschelli	Geoffrey Zakarian	Asian pears, croissants, haricots verts, rattlesnake meat	tapioca pearls, carrots, fruit leather, rabbit	yucca, calimyrna figs, hoisin sauce, red jalapeños	Siggy Sollitto	Chef and Restaurateur  Siggy's Good Food  Brooklyn Heights  "
4	2	41	8.3	My Froggy Clementine	
4	3	42	8.6	Jitters & Giant Eggs	
"4	4	43	8.3	Dr. Deckle & Mr. Fried	Later reruns of this episode were dedicated to the memory of Michael Siry who died from cancer in June 2013.	April 27, 2010	Scott Conant	Amanda Freitag	Aarón Sánchez	collard greens, jumbo shrimp, corn chips, olive loaf	broccoli rabe, deckle of beef, hibiscus flowers in syrup, black-eyed peas	avocadoes, oyster sauce, tofu skins, star fruit	Abigail Hitchcock	Chef and Restaurateur  Camaje Bistro  "
"4	5	44	8.5	Mussels Mastery & Cotton Candy Can-Do	This is Marcus Samuelsson's first episode as a judge.	May 4, 2010	Marcus Samuelsson	Alex Guarnaschelli	Aarón Sánchez	mussels, asparagus, cactus pear, kidney beans	sharp cheddar cheese, watermelon radish, squab, frozen waffles	saltine crackers, green papaya, dried mangoes, cotton candy	Sean Mell	Omakase Chef  "
4	6	45	8.3	First Things Worst	
"4	7	46	8.5	Fired Up!	This was a grilling-themed episode. The stove tops were outfitted with grill sheets and the ovens were off-limits. Chef Jenkins is a chef at Butter, which is co-owned by regular Chopped judge, Alex Guarnaschelli.	June 1, 2010	Chris Santos	Amanda Freitag	Aarón Sánchez	striped sea bass, strawberries, baby fennel, marshmallows	country pork ribs, kale, butternut squash, popcorn on the cob	polenta, lambic beer, pineapple, hot dogs	Mary Beth Johnson	Executive Chef  Maritime  "
"4	8	47	8.5	Quahog Quandaries and Pickle Puzzles	This was the first episode to feature an all-female panel of judges.	June 8, 2010	Amanda Freitag	Alex Guarnaschelli	Jody William	quahog clams, rhubarb, almond butter cookies	venison tenderloin, cinnamon swirl bread, sharon fruit, cornichons	matzo, salty peanuts, dried strawberries, cocoa nibs	Melissa Muller	Executive Chef  Organika  "
4	9	48	8.6	Turbot Powered	
4	10	49	8.5	Keep On Cook'n On	
4	11	50	8.5	Green Apps and Lamb	
"4	12	51	9.2	Crunch Time	This was the first appearance of Madison Cowan, who would go on to appear on various Food "
4	13	52	8.2	Rowdy With a Chance of Meatballs	
"5	1	53	8.6	Dream'n of Redeem'n	This episode featured four past runners-up who returned for a second chance at the $10,000 prize. This is the 1st time since Season 3 that there were 3 ingredients in a basket. Chef Garand cut herself in Round 1	July 20, 2010	Geoffrey Zakarian	Alex Guarnaschelli	Marc Murphy	rump roast, rainbow chard, vegetable yeast spread	branzino, piquillo peppers, jicama, chocolate sandwich cookies	vodka, crescent roll dough, sesame seeds, blueberry jelly beans	Paul Viggiano	""Cooking Instructor  Episode 2.5 – """"Pretty Please With a Pepper on Top""""""	Lola Garand	""Freelance Consulting Chef  "
5	2	54	8.4	Wok This Way	
"5	3	55	8.6	Squashed	This was the first episode to feature four female chefs.	August 10, 2010	Marcus Samuelsson	Alex Guarnaschelli	Geoffrey Zakarian	banana chips, rice paper, kabocha squash, sardines	beef shoulder, baby artichokes, blood oranges, cashew butter	celery root, cinnamon candies, blackberries, marshmallow spread	Jessica Wilson	Sous chef  A Voce Columbus  "
"5	4	56	8.9	$50,000 Tournament: Round One	This was the first tournament with four preliminary heats leading up to a finale; it would set the precedent for future Chopped tournaments. This is a five part series where sixteen past champions competed. The winner of each episode advanced to the finale, where they competed for $50,000.	August 31, 2010	Chris Santos	Amanda Freitag	Marc Murphy	tomatillos, horned melon, wonton skins, Rocky Mountain oysters	dorade, baby beets, beef jerky, coffee liqueur	Yukon Gold potatoes, condensed milk, pomegranates, peanut butter taffy	Jessica Mogardo	""Executive Pastry Chef  "
"5	5	57	8.7	$50,000 Tournament: Round Two	This is part two of a five part tournament.	September 7, 2010	Geoffrey Zakarian	Amanda Freitag	Marc Murphy	dandelion greens, Greek yogurt, liverwurst, catfish	ginger beer, pickled daikon, okra, alligator tenderloin	key lime juice, pepitas, halloumi cheese, hot dog buns	Michael Jenkins	""Line cook  Butter  "
"5	6	58	8.7	$50,000 Tournament: Round Three	This is part three of a five part tournament.	September 14, 2010	Geoffrey Zakarian	Alex Guarnaschelli	Marc Murphy	dried persimmon, phyllo dough, pepper jack cheese, sweetbreads	chicken breast, blue corn tortillas, Tuscan kale, sea urchin	blueberries, bread & butter pickles, saffron, fruit ring cereal	Joe Dobias	""Chef and Restaurateur  Joe Doe Restaurant  "
"5	7	59	8.6	$50,000 Tournament: Round Four	This is part four of a five part tournament.	September 21, 2010	Chris Santos	Alex Guarnaschelli	Marc Murphy	cold-smoked kippers, water chestnuts, leeks, lemon-lime soda	caperberries, parsley root, chocolate-hazelnut spread, elk tenderloin	taco shells, Bosc pears, crema, red curry paste	Christian Petroni	""Chef and Restaurateur  Barcelona  Greenwich  CT  Episode 4.5 – """"Mussels Mastery & Cotton Candy Can-Do""""""	Rebecca "
"5	8	60	9	$50,000 Tournament: Grand Finale	This is the final part of the first Chopped tournament. The chefs were given 50 minutes in the dessert round rather than the normal 30 to allow adequate time to bake.	September 28, 2010	Geoffrey Zakarian	Alex Guarnaschelli	Marc Murphy	geoduck, Buddha's hand, black radishes, waffle cones	smelt, dried red currants, cheese curls, rack of wild boar	champagne, dragon fruit, tahini, cake flour	Marc Anthony Bynum	""Executive Chef  Venúe 56  Hauppauge  "
"5	9	61	8.5	Spouting Off	In the dessert round, Ted warned the contestants that cherimoya seeds were poisonous.	October 5, 2010	Amanda Freitag	Alex Guarnaschelli	Geoffrey Zakarian	barramundi, apricot paste, poblano peppers, abbey style beer	bratwurst, scallops, plums, red quinoa	Israeli couscous, cherimoya, guanciale, Irish whiskey	Sung Uni Lee	Culinary Instructor  Brooklyn  "
"5	10	62	8.6	When Octopuses Attack	Chef Testino would compete on the twelfth season of Hell's Kitchen.	October 12, 2010	Aarón Sánchez	Alex Guarnaschelli	Marc Murphy	lotus root, treviso, guava nectar, octopus	flank steak, chicory, pepino melon, granola bars	shiso leaves, pita bread, feta, adzuki beans	""Anthony """"Anton"""" Testino""	Head Chef  Tony's Touch of Italy  Wayne  "
"5	11	63	8.5	Fright Bites	This was the first Halloween-themed episode of the series. Chef Mike forgot an ingredient, malted milk balls, in round 1 which led to his elimination. Chef Michael forgot his tortillas in round 2 but moved on because Chef Marja cross-contaminated her chicken.	October 19, 2010	Chris Santos	Amanda Freitag	Geoffrey Zakarian	canned pumpkin, malted chocolate balls, pie crust, lamb heart	gummy teeth, flour tortillas, huitlacoche, black chicken	kumquats, cheddar pennies, chipotle chiles, grasshoppers	Mike Solyn	Freelance Chef  "
"5	12	64	8.6	Cornuchopia	This was a Thanksgiving-themed episode with corresponding, seasonal ingredients in the baskets. The chefs had to stick to a Thanksgiving theme for all three courses.	"
"5	13	65	8.8	Yes, Virginia, There is a Chopping Block	This was a holiday-themed episode. The chefs were directed to prepare holiday-themed dishes for each course. The chefs were given 40 minutes in the entrée round rather than the normal 30 in order to allow time to properly cook the goose.	"
"6	1	66	8.6	Victory on the Brain	The fish heads used in the entrée round were from northeastern cod.	January 4, 2011	Scott Conant	Geoffrey Zakarian	Aarón Sánchez	tamarind soda, cocktail nuts, haricots verts, goat brains	Cream of Coconut, baby turnips, wakame seaweed, fish heads	peanut brittle, marsala wine, wonton wrappers, durian	Colin Kruzic	Executive Chef  "
"6	2	67	8.2	Prove it on the Plate	This is Maneet Chauhan's first episode as a judge.	January 11, 2011	Scott Conant	Maneet Chauhan	Geoffrey Zakarian	"
6	3	68	8.4	Marrowly We Roll Along	
"6	4	69	7.6	Doughs and Don'ts	Chef Santorelli cut herself badly in the appetizer round and she lost time.	January 25, 2011	Scott Conant	Amanda Freitag	Chris Santo	saba, garlic chutes, Canadian bacon, trout	dehydrated okra, parsnips, espresso soda, deckle of beef	coquitos, turmeric, empanada wrappers, corn on the cob	Rob Runn	Food Service Specialist  USCGC Sturgeon Bay  WTGB-109  Bayonne  "
6	5	70	8.5	Step Right Up!	
6	6	71	8.5	All-Stars Tournament: Round One – Competitors from The 
6	7	72	8.6	All-Stars Tournament: Round Two – Food 
6	8	73	8.8	All-Stars Tournament: Round Three – 
"6	9	74	8.5	All-Stars Tournament: Round Four – Chopped Judges	This is part 4 of a 5-part tournament. This marked the first time the Chopped judges competed. The chefs were given 40 minutes in the entrée round rather than the normal 30 to allow time to properly cook the duck.	March 27, 2011	Chris Santos	Alex Guarnaschelli	Marc Murphy	papadum, baby romanesco, smoked lake chub, powdered strawberry milk	taralli, natto, radicchio, whole duck	green plantains, Chinese bacon, peanut butter puff cereal, frozen lemonade	Maneet Chauhan	charity: Clinton Global Initiative – "
"6	10	75	9.1	All-Stars Tournament: Grand Finale	This is the last part of a 5-part tournament. The celebrity chefs who won the previous 4 heats returned to compete for $50,000 towards their charity.	April 3, 2011	Marc Murphy	Alex Guarnaschelli	Marcus Samuelsson	rabbit kidneys, baby beets, merguez, salt and vinegar potato chips	goat leg, dried hibiscus flower, pattypan squash, trail mix	sesame candies, ruby red grapefruit, chayotes, chickpeas	Michael Proietti	charity: The Jed Foundation – "
"6	11	76	8.9	A Cornish Mess	In the entrée round, Chef Duverney committed cross-contamination by cutting her cooked hens on the same board where she put her raw hens. Chef Greco served under cooked, raw hen due to the time constraints. The judges allowed the both of them to bring over the other components of the dish from their stations. In the dessert round Ted warned the chefs that Cherimoya Seeds were Poisonous. However Chef Greco got two seeds on one plate. He did not get them in his dish so it was still edible however that resulted in his elimination.	April 10, 2011	Scott Conant	Maneet Chauhan	Chris Santo	graffiti eggplant, cape gooseberries, biscuit dough, Peking duck	Cornish hens, Concord grapes, gruyère cheese, banana leather	Italian orange liqueur, cheese crackers, cherimoya, Jordan almonds	Gillie Holme	Caterer  "
6	12	77	8	Chefs on a Mission	
"7	1	78	8.4	The Icing on the Steak	Chef Fox cut herself in Round 1.	May 3, 2011	Chris Santos	Amanda Freitag	Marc Murphy	smoked turkey legs, ramen noodles, cherry bomb peppers, endive	celery root, rainbow chard, flat iron steak, chocolate frosting	bananas, pomegranate juice, phyllo dough, white miso	Crystal Fox	Chef  Sisters "
"7	2	79	8.5	Canned Cheese, Please!	Chef Ricks is a chef at Landmarc, a restaurant of Chopped judge, Marc Murphy.	May 10, 2011	Chris Santos	Amanda Freitag	Aarón Sánchez	andouille sausage, lychees in syrup, jalepeño peppers, canned cheese	buckwheat groats, jews mallow, hard cider, elk tenderloin	strawberry popsicles, blue corn tortilla chips, condensed milk, celery	Billy Brigtsen	Chef  Brooklyn  "
7	3	80	8.1	Saying Sayonara	
"7	4	81	8.2	Have a Heart	Chef Ramirez flat-out refused to use an ingredient due to not cooking it right in Round 1 resulting in his elimination.	May 24, 2011	Aarón Sánchez	Alex Guarnaschelli	Ken Oringer	bay scallops, braeburn apples, sorrel, duck hearts	fideos, broccoli rabe, mezcal, eel	crumpets, cream cheese, aloe vera juice, orange slice candy	John Ramirez	Executive Sous chef  Castle on the Hudson  Tarrytown  "
"7	5	82	8.6	Gotta Grill!	This was a grilling-themed episode. The stovetops were outfitted with grill sheets and two other burners and the ovens were off-limits throughout the competition. The chefs were also given pre-soaked cedar planks that they could use if they wished. This was the first time since season 5 that there were only three basket ingredients in the appetizer round instead of four.	May 31, 2011	Amanda Freitag	Alex Guarnaschelli	Geoffrey Zakarian	coho salmon, baby eggplant, mustard	rack of wild boar, artichokes, ketchup, sauerkraut	mayonnaise, bananas, prickly pear cactus, pre-cooked pizza crust	""Vucic """"Vulé"""" Dabetic""	Executive Chef  Arcane  "
7	6	83	8.5	Get it Together	
7	7	84	8.4	Bite Your Pickled Beef Tongue	
7	8	85	8.5	Go For It!	
"7	9	86	8.8	Thyme Flies	In the entree Chef Claude-Mendy forgot an ingredient (anchovies) but didn´t get chopped because Chef Lee cut himself during the entrée round but continued cooking and touching the ingredients despite bleeding through several layers of gloves. The judges considered this unsanitary, so they did not taste his entrée. This resulted in Chef Lee being eliminated.	June 28, 2011	Aarón Sánchez	Alex Guarnaschelli	Marc Murphy	Korean-style short ribs, lemon thyme, zucchini, gefilte fish	hen of the woods mushrooms, white anchovies, lamb top round, salsa con queso	dried apricots, gingerbread cookie dough, elderflower liqueur, halva	Marc Matsumoto	Private Chef  "
7	10	87	8.2	
"8	1	88	8.8	Easy Peasy?	This is the first episode to feature four British chefs as well as the first to have no contestants who are settled in the United States.	July 12, 2011	Geoffrey Zakarian	Amanda Freitag	Marc Murphy	buffalo hot dogs, carrots, edamame, butterscotch candy	pork loin, crunchy cheese curls, escarole, chia seeds	grape flavored gelatin, lemon verbena, brie, shortbread cookies	Tristan Welch	Chef Patron  Launceston Place  Kensington  London  England	Andy Bates	Pastry Chef  Eat My Pies Street Market  East London  England	Lotte Duncan	Chef and Culinary Instructor  English Country Cookery School  Buckinghamshire  England	Jun Tanaka	Executive Chef  Pearl Restaurant  London  England"
