season	season_episode	series_episode	episode_rating	episode_name	episode_notes	air_date	judge1	judge2	judge3	appetizer	entree	dessert	contestant1	contestant1_info	contestant2	contestant2_info	contestant3	contestant3_info	contestant4	contestant4_info
"29	13	363	5.5	Worst Cooks Challenge	Contestants were previous winners and runners-up from Worst Cooks in America. Anne Burrell served as the guest judge for th	September 27, 2016	Anne Burrell	Scott Conant	Chris Santo	frog legs, red finger chilies, bok choy, pig face roulade	hanger steak, baby corn, tequila, lime curd	bosc pears, black currant dijon, cocoa powder, brown sugar cinnamon pita chips	Amber Brauner - Season 5 Winner	"
"30	1	364	8.3	Kefir and Loathing	Guest judge Giorgio Rapicavoli is a two-time Chopped Champion.	September 22, 2016	Geoffrey Zakarian	Amanda Freitag	Giorgio Rapicavoli	pork secreto, asparagus, kefir, truffle flavored potato chips	black sea bass, yuca, flat runner beans, blueberry grappa	knafeh, passion fruit, pistachio paste, brown bread in a can	Enzo "
30	2	365	8.2	Sweetbread Dread	
"30	3	366	7.9	Best Halloween Ever	This was a Halloween themed episode with all amateur cooks dressed in costumes. The zombie hand was meatloaf in the shape of a hand and mashed potatoes. The jack o' lantern peppers were orange bell peppers cut to resemble jack o' lanterns. The bloodshot eyeballs were dyed hard-boiled eggs. The salty fingers were sea beans. The worms in dirt were gummy worms and chocolate sandwich cookies.	October 3, 2016	Maneet Chauhan	Amanda Freitag	Scott Conant	zombie hand, dinosaur kale, ghost pepper mayo, jack o' lantern peppers	bloodshot eyeballs, bone marrow, salty fingers, pork tenderloin	goat cheese spider, candy corn cookies, worms in dirt, horned melon	Ebony Amber	Costume Designer from Torrington  CT	James Roberts	Medical File Clerk from Long Island  "
30	4	367	7.4	On the Quack Burner	
"30	5	368	7.4	Web Stars	For this episode, the four contestants competing are YouTubers who run cooking shows on their channel.	October 11, 2016	Marcus Samuelsson	Alex Guarnaschelli	Laura Vital	emoji cookies, fennel, apricots, ground beef	boar shoulder, sun-dried tomatoes, puff pastry, canned mac n cheese	vanilla cake mix, lavender, Szechuan peppercorns, almond water	""Ameer Atari from """"Epic Meal Time""""""	"
30	6	369	
30	7	370	
30	8	371	
31	1	372	7.6	Smorgastarta Your Engines	
"31	2	373	8.5	Tailgate Greats	All the contestants were amateur cooks (but experienced tailgaters) and the theme of the episode was tailgating. In keeping with the theme, the contestants wore specially made Chopped football jerseys instead of chef coats, and the baskets were replaced with coolers. The contestants had 30 minutes in the appetizer round.	October 18, 2016	Marc Murphy	Amanda Freitag	Chris Santo	tailgate sandwiches, vegetables and dip, caramel corn, black bean salsa	baby back ribs, brewmosa, hot Italian peppers, potato salad	football pies, white nectarines, raspberry lambic beer, potato chips	Ali Muhammad from Cranford	"
"31	3	374	7.1	Chopped: Beat Bobby Flay, Part 1	First part of a 4-part tournament featuring twelve returning Chopped champions. Each episode's winner progressed to the finale, where the three episode winners competed to determine the tournament finalist. The finalist would choose a dish and compete for $40,000 against Bobby Flay in making a better version of the dish. For the whole tournament, one item in each basket was chosen by Bobby Flay.	October 20, 2016	Bobby Flay	Marc Murphy	Chris Santo	lutefisk, mache, skordalia, crunchy berry cereal (Bobby's choice)	beets, rose water syrup, chocolate-covered onions, lamb short ribs (Bobby's choice)	wine flour, Mayhaw jelly, grilled cheese sandwiches, Marcona almonds (Bobby's choice)	Mackenzie Hilton	""Episode 4.1 – """"Rattle & Roll""""""	Bradley Stellings	""Episode 18.11 – """"Beer Here!"""" and  Episode 23.3 – """"Chopped Again!""""""	Jay Abrams	""Episode 27.6 – """"Bacon Boys""""""	Demetrio Zavala	""Episode 31.1 – """"Smorgastarta Your Engines""""  advances to final round"""
"31	4	375	7.9	Midnight Snack Attack	The theme for this episode was late-night food.	October 25, 2016	Maneet Chauhan	Amanda Freitag	Aarón Sánchez	fried chicken, garlic scapes, Moscow mule, beet doughnuts	blue foot mushrooms, pizza, duck fat fries, halal cart lamb & rice	breakfast sandwich, fruit cereal, sour plums, rum butter ice cream	Alexa Wilkinson	Executive Chef from "
"31	5	376	8.1	Chopped: Beat Bobby Flay, Part 2	Second part of a 4-part tournament. Chef Thomas is the youngest competitor in this tournament, having won the first all-teen episode back in season 13. In round 1, the can of fruit contained peaches, grapes, pears, and cherries. Also, due to the extensive prep time required, the abalone in round 1 was pre-cleaned.	October 27, 2016	Bobby Flay	Amanda Freitag	Scott Conant	tropical fruit in a can, Delfino cilantro, abalone, fresno peppers (Bobby's choice)	whole Alaskan king crab, purple snow peas, lemon ice box cake, corn nuts (Bobby's choice)	licorice flavored liqueur, plums, cinnamon bun pancakes, crème fraîche (Bobby's choice)	Shania Thomas	""Episode 13.3 – """""
31	6	377	8	Chaudin Chow (aka Hearty Party)	
"31	7	378	8.1	Chopped: Beat Bobby Flay, Part 3	""Third part of a 4-part tournament. Contestants Matt Romine and Mike Romine previously competed together in a twins' team competition episode, but competed individually in this episode. The """"ultimate milkshake"""" in the third round was reminiscent of """"unicorn milkshakes"""" that are overloaded with rainbow candies, rainbow cereal, and colorful cookies in a large mug.""	"
"31	8	379	7.5	Cheap Eats	The theme of this episode revolved around inexpensive food items leading to the basket ingredients being convenience food items or street food. Chef Palamaro is a sous chef at Tertulia, owned by Chopped guest judge Seamus Mullen.	"
"31	9	380	8.7	Chopped: Beat Bobby Flay, Finale	Final part of a 4-part tournament. The 3 finalists competed over 2 rounds (appetizer and entree) to win a guaranteed $15,000. The winner faced Bobby Flay in a $25,000 wild card round for a chance to increase their winnings to $40,000. This round was played like the second round on Beat Bobby Flay with both chefs making a dish of the winner's choice, which in this case was bibimbap. The chefs had 45 minutes in the 3rd round instead of the usual 30 to accommodate the crossover format.	"
31	10	381	8.3	Battle of the Butchers	All four chefs were professional butchers. The chefs were given 30 minutes in the appetizer round and 40 minute in the entrée round in order to butcher their proteins properly.	
"31	11	382	8.3	Beast Feast	very basket contained whole roasted animals, which were placed in the pantry rather than the baskets due to their size.	"
31	12	383	7.9	Back in Time	The theme of this episode was retro-inspired food. All the basket contained old-fashioned ingredients.	
31	13	384	
"31	14	385	7.8	Entree Basket Blues	""This episode was mistakenly labelled as """"Jump for Bok Choy"""" on the Food "
"31	15	386	8.6	Taco Time!	The contestants had to make tacos for every round in this episode.	December 8, 2016	Aarón Sánchez	Alex Guarnaschelli	Marc Murphy	tripe, oranges, mustard rabe, coffee-flavored liqueur	pork shoulder, baby watermelon, hearts of palm, hoisin sauce	churro cake, goat's milk, serrano peppers, Mexican chocolate	Elena Cruz	Chef & Co-Owner from Kingston  "
31	16	387	8.1	Sweet Heat	
"31	17	388	8.1	Betting on the Farm	All the chefs worked at farm-to-table style restaurants and the basket ingredients leaned towards local or farm-themed foods.	December 15, 2016	Marc Murphy	Amanda Freitag	Chris Santo	local chickens, pickled chilis, baby squash with blossoms, switchel	grass-fed lamb shoulder, polenta, gummy farm animals, wild arugula	corn on the cob ice cream, gooseberries, goat's milk, farm fresh duck eggs	Marjory Sweet	Farmer and Chef from Albuequerque  "
"31	18	389	8.5	Million Dollar Baskets	ach chef specialized in high-end cuisine and each basket contained high-end ingredients, all of which were expensive. The flight of caviar in the first round contained three different varieties of caviar for the chefs to use. Chef Browne is the son of actors Kale Browne and Karen Allen.	December 22, 2016	Marcus Samuelsson	Alex Guarnaschelli	Maneet Chauhan	flight of caviar, dried matsutake mushrooms, purple asparagus, hamachi	summer black truffles, pure maple syrup, broccoflower, mangalitsa pork	macadamias, pear brandy, champagne grapes, gold doughnuts	Faiz Ally	Executive Sous Chef from Washington D.C	Ivan Saez	Executive Chef from Washington D.C	Meena Throngkumpola	Executive Sous Chef from "
31	19	390	7.6	Basket Buzz	
"31	20	391	8.2	Wild Times	""ach basket had wild ingredients (game and/or wild plants). Guest judge Jonathon Sawyer was the Chopped Champion from the """"Grill Masters "
"32	1	392	7.4	Clean Eatin'	The contestants were given healthy, fresh ingredients and told to cook healthy, low-calorie meals.	January 3, 2017	Marc Murphy	Amanda Freitag	Chris Santo	muffin tops, Russian red kale, soaked beans, whole milk yogurt	side of tuna, stonecrop, kombucha, shirataki noodles	banana chocolate frozen dessert, raspberries, kaniwa, angel food cake	Elisa Lyew	Chef & Restaurateur from Brooklyn  "
"32	2	393	7.1	Whiskey and Wings	ach basket contained different types of whiskey and wings. In the entree round the chefs were given a caddy of five different hot sauces, and the celery, carrots, and blue cheese were all on a platter which counted as one ingredient.	January 10, 2017	Aarón Sánchez	Geoffrey Zakarian	Chris Santo	chicken wings, curly fries, Chinese broccoli, Japanese whiskey	(pre-cooked) turkey wings, hot sauces, (platter of) celery, carrots, & blue cheese, quinoa whiskey	angel wings, peaches, braised bacon, Rock & Rye	Russell Stippich	Sous Chef from Denver  CO	Chris Burnett	Head Sous Chef from Little Silver  "
"32	3	394	7.2	Celebrating Veterans	All four contestants were military veterans. While Chopped normally obscures brand names, the pot pie in the entrée basket was Marie Callender's brand. Each of the chopped chefs had $5000 donated in their name from Marie Callender's to a different charity. The winner also received a $10,000 donation to charity in addition to the usual $10,000 prize.	January 17, 2017	Chris Santos	Alex Guarnaschelli	Marc Murphy	cheeseburgers, haricot verts, potato tots, sweet tea	""chicken pot pie, watercress, pork chops, """"stars & stripes"""" pasta""	candy apples, blondies, vanilla pudding mix, American cheese	Paul Maloney	Executive Chef and "
32	4	395	7.5	Oodles of 
"32	5	396	7.6	Game Day Party	The baskets were game day (American Football) themed.	January 31, 2017	Scott Conant	Geoffrey Zakarian	Eddie Jackson	truffled mac & cheese, spigarello, pale ale, sliders	purple potatoes, sangria artichokes, mortadella hot dogs, chili	soft pretzels, husk cherries, blue sports drink, pig skin	""Jon """"DJ Dallas Green"""" Rosa""	Caterer & DJ from Harlem  "
"32	6	397	8	Chocolate Obsession	The theme of the episode was chocolate. Each basket contained two chocolate ingredients.	February 7, 2017	Maneet Chauhan	Katrina Markoff	Zac Youn	soft-shell crabs, chocolate olive oil, pomegranate seeds, white chocolate-covered caviar	milk chocolate mille crêpe cake, chocolate whiskey, pork shanks, purple spinach	dark chocolate decadence cake, dark chocolate seaweed candy, pistachio cream, apricots	Jenny Dorsey	Chef from "
"32	7	398	8.5	Blue Plate Fate	The theme of this episode is diner-style food. All four contestants are diner chefs.	February 14, 2017	Marc Murphy	Amanda Freitag	Chris Santo	BLTs, marionberry jam, string beans, disco fries	cube steak, beets, craft beer, deep-fried deviled eggs	coconut arancini, variegated figs, cheesecake, coffee with creamer	Arleen Harkins	Executive Chef & Owner from Red Hook  "
"32	8	399	7.7	Chefs in a Pickle	This episode had pickled ingredients in every basket.	February 21, 2017	Geoffrey Zakarian	Alex Guarnaschelli	Chris Santo	sliced pickled pork, brussels sprouts, pickleback, clotted cream	flank steak, half-sour pickles, perilla leaves, rainbow carrots	bread-and-butter pickles, pretzel croissants, chunky peanut butter, cherries	Mandla "
"32	9	400	7.9	Raw Deal	The buffalo steaks in round 2 were given to the chefs as a whole sirloin roast.	February 28, 2017	Chris Santos	Amanda Freitag	Maneet Chauhan	sushi burgers, fresh wasabi, longan berries, pork floss	buffalo top sirloin steaks, porcini mushrooms, ají dulce, sea buckthorn juice	polenta cake, béchamel sauce, plums, pink Himalayan sea salt	Steven Londoño	Sous Chef from Brooklyn  "
"32	10	401	8.2	Something Dumpling	The chefs were required to make dumplings of any form in each round. To accommodate the theme, each chef was provided with a preheated pot of oil, and the pantry was stocked with assorted dumpling wrappers. In the appetizer round, Chef Maccioni didn't get any food onto his plates and though the judges tried the food in his pans, he was chopped (making this the second time in the series that a contestant didn't plate anything before time ran out.)	March 7, 2017	Chris Santos	Geoffrey Zakarian	Aarón Sánchez	pork belly, savoy cabbage, black walnuts in syrup, red yuzu kosho	ground lamb, mashed potatoes, swiss chard, dried kiwi	sriracha potato chips, farmer's cheese, rambutan, ginger shrub	Mauro Maccioni	Chef and Co-Owner from "
"32	11	402	7.8	Latin Cuisine Dream	This episode features chefs from different Latin American countries who emigrated to the United States. There were also Latin American ingredients in each basket.	March 14, 2017	Chris Santos	Geoffrey Zakarian	James Tahhan	sancocho, lulo, blue masa dough, chicharrón de cerdo	stewing hens, pinto beans, alfajores, yuca	yellow rice, candy-covered peanuts, mangos, coquito	Miguel Samanez	Sous Chef from "
32	12	403	
"33	1	404	7.6	Best Laid Pans	All four of the contestants were women.	March 21, 2017	Marcus Samuelsson	Maneet Chauhan	Geoffrey Zakarian	duck and armagnac sausage, mixed berry applesauce, leeks, okra	spaghetti pie, tomatillos, coulotte steak, burrata cheese	trifle, Thai chili peppers, orange blossom water, anjou pears	Jennifer Lopez	Executive Chef from Washington D.C	Carolina Saavedra	Sous Chef from Bronx  "
"33	2	405	7.3	Star Power: Web Stars!	Part 1 of a 5-part celebrity tournament featuring 16 celebrities competing to win $50,000 for charity. Contestants in this heat were internet personalities with a considerable online following.	March 28, 2017	Geoffrey Zakarian	Amanda Freitag	Scott Conant	blood sausage, shishito peppers, Japanese mayonnaise, dates	duck breast, broccoli rabe, mashed potato pancakes, Thai iced tea	mango mochi ice cream, quince paste, instant oatmeal packets, dragon fruit	Justine Ezarik	"
"33	3	406	7.3	Star Power: Culinary Muscle!	Part 2 of a 5-part celebrity tournament. Contestants in this heat were current and former athletes.	April 4, 2017	Scott Conant	Alex Guarnaschelli	Eddie Jackson	wagyu ground beef, Swiss chard, eggplant rollatini, ranch dressing soda	lamb noisette roast, avocados, za’atar bread, frozen mint lemonade	rice pudding-stuffed brioche, blood oranges, protein powder balls, strawberry rock candy	LaMarr Woodley	"
"33	4	407	7.1	Star Power: The Last Laugh!	Part 3 of a 5-part celebrity tournament. Contestants in this heat were all comedians.	April 11, 2017	Scott Conant	Amanda Freitag	Marc Murphy	Jonah crab claws, sweet piquante peppers, asparagus, arepas	"
"33	5	408	7.2	Star Power: Screen Sensations!	Part 4 of a 5-part celebrity tournament. Contestants in this heat were film and television actors. This episode marks Alan Thicke's final television appearance before his death.	April 18, 2017	Marcus Samuelsson	Amanda Freitag	Scott Conant	striped bass fillets, squash purée, microgreens, passion fruit ice pops	chicken kebobs, pickled gooseberries, purple cauliflower, truffle popcorn	financiers, blueberries, candied fruit slices, statuette lollipops	Alan Thicke	"
"33	6	409	7.5	Star Power: Grand Finale	Part 5 of a 5-part celebrity tournament. The swineapple in the second round was a pineapple stuffed with ribs and covered in bacon.	April 25, 2017	Geoffrey Zakarian	Alex Guarnaschelli	Scott Conant	lobster tails, leaf lettuce iceberg, star fruit, cinnamon toaster pastries	yuca chips, bitter melon, brandy, swineapple	macarons, soursop, drinkable yogurt, pistachios	Paige VanZant	"
33	7	410	7.1	The 
33	8	411	8.6	An Ugly Turn	The chefs had to work with ugly ingredients in each basket. Guest judge Saywer was a finalist in Chopped: Grill Masters 
"34	1	412	8.7	Thanks, Mom!	The contestants were Food "
"34	2	413	8.2	Grill Game	This was a grilling-themed episode. The ovens were turned off and the stovetops were outfitted with grill pans and griddles. While Chopped normally obscures brand names, the meat sauce in the entree basket was A1 Steak Sauce, a product of a Chopped sponsor. Chef Campbell is the daughter of Leslie Roark Scott, a finalist in the second season of Chopped Grill Masters.	May 23, 2017	Marc Murphy	Amanda Freitag	Maneet Chauhan	longaniza, grilled stuffed onions, asparagus, frozen cherry daiquiri	venison rib rack, charred caprese sandwich, baby corn, meat sauce	roasted marshmallow shots, figs, almonds, grilled peaches and cream cake	Erin Campbell	Competitive BBQ Champ from Yazoo City  MS	Shane Vidovic	Chef and Restaurateur from Lakewood  OH	Eusebio Gongora	Culinary Director from Baton Rouge  LA	Tanya Cauthen	Butcher from Richmond  VA"
"34	3	414	8.4	Greater Tater	The theme of this episode was potatoes, which were featured in two forms in every basket. Chef Chatman is a line cook for Chopped judge Alex Guarneschelli.	June 6, 2017	Marcus Samuelsson	Amanda Freitag	Ali Khan	purple potatoes, potato tots, garlic chives, Canadian bacon	Kennebec potatoes, chili cheese fries, porterhouse steaks, fresh wasabi	loaded baked potatoes, sweet potato pie, dried cranberries, English toffee	Bea Rocchetti	Sous Chef from Farmington Hills  MI	Miguel Franco	Executive Chef from "
"34	4	415	7.4	Father's Day	This was a home cook, team competition: four fathers paired up with their adult children. The teams were given 30 minutes in the appetizer round instead of 20.	June 13, 2017	Scott Conant	Amanda Freitag	Marc Murphy	ground beef, Japanese eggplant, date syrup, remote control cookie	salmon fillet, candy cane beets, cassava sticks, fava beans	bacon gelato, Belgian ale, cactus pear, pretzel bark	Mike Hannah and Melissa Hannah from Cleveland	OH	Mark Sheridan and Kevin Sheridan from Cleveland	OH	Johnny Hall and Yahaira Hall from Brooklyn	"
34	5	416	8.1	Got Your Goat?	
"34	6	417	8.6	Snap Pea to It!	While Chopped normally obscures brand names, the pomegranate juice in the appetizer round was POM Wonderful, a product of a Chopped sponsor.	June 27, 2017	Scott Conant	Alex Guarnaschelli	Marcus Samuelsson	lamb kebabs, pomegranate juice, Chinese broccoli, avocado toast	Cornish hens, black rice, snap peas, watermelon radish	olive oil cake, papaya, kiwi, kefir	Jimmie Rondon	Sous Chef from "
"34	7	418	8.6	Bangin' Backyard Cookout	The theme of this episode was backyard barbecuing. The classic burger fixings in the second round contained onions, tomatoes, and lettuce. The watermelon grill in the third round was half a hollowed out watermelon with fruit skewers on top placed to resemble grill grates.	July 4, 2017	Scott Conant	Alex Guarnaschelli	Elizabeth Heiskell	burger-wrapped hot dogs, half-sour pickles, kasundi, macaroni salad	beer-can chicken, eggplant, double-smoked bacon, classic burger fixings	watermelon grill, corn chips, strawberry shortcake, sweet tea vodka	Jessica Johnson	Chef and Restaurateur from Cleveland  OH	Craig Walker	Chef and Restaurateur from "
"34	8	419	8.7	Flour Power	This episode had all female pastry chefs. They were required to bake something in each round. The chefs were given 30 minutes in the appetizer round and 45 minutes in the dessert round to showcase their pastry talents.	July 11, 2017	"
"34	9	420	8.8	Alton's Challenge, Part 1	This is part 1 of a 5-part tournament where Alton Brown picks the baskets with specific scientific, gastronomic techniques in mind. The theme of this episode is smoke and the contestants are required to infuse smoke into each dish. A basket ingredient in the entree round (the meatballs) was smoked by Alton himself.	October 10, 2017	Alton Brown	Maneet Chauhan	Hugh Acheson	smoked salmon macarons, black garlic, micro radishes, Chilean sea bass	hard smoked eggs, cardoons, red shishito peppers, smoked meatballs	pig skin, Anjou pears, mozzarella, suanmeitang	Leah Gourlie	Pastry Chef and Owner from Cleveland  OH	Jamal Bland	Executive Chef from "
"34	10	421	8.6	Alton's Challenge, Part 2	This is part 2 of a 5-part tournament where Alton Brown picks the baskets with specific scientific, gastronomic techniques in mind. The theme of this episode is dehydration, with at least one dehydrated ingredient in each round. A basket ingredient in the entree round (the beef jerky) was made by Alton from brined, dehydrated flank steak.	October 17, 2017	Alton Brown	Amanda Freitag	Marcus Samuelsson	instant mashed potatoes, tuna floss, cucumbers with blooms, bacalao	clams, tomato crisps, olives, beef jerky	space ice dream, Sharon fruit, dried pomegranate seeds, dehydrated scrambled eggs	Lisa Pucci Delgado	Private Chef from Cleveland  OH	Vinnie Cimino	Chef de Cuisine from Cleveland  OH	Ben Bebenroth	Chef and Restaurateur from Cleveland  OH	"
"34	11	422	8.8	Alton's Challenge, Part 3	This is part 3 of a 5-part tournament where Alton Brown picks the baskets with specific scientific, gastronomic techniques in mind. The theme of this episode is molecular gastronomy, with at least one modernist ingredient in each round. A basket ingredient in the entree round (lamb rib roast) was set aside on a separate table. It was cooked sous-vide inside an immersion circulator.	October 24, 2017	Alton Brown	Amanda Freitag	Wylie Dufresn	transparent ravioli, rainbow carrots, crab legs, tapioca maltodextrin	zucchini blossoms, arugula noodles, poached pears, lamb rib roast	raindrop cake, blood oranges, popping sorghum, cookie dough ice cream sandwiches	Tiffany Schleigh	Pastry Chef from "
"34	12	423	8.7	Alton's Challenge, Part 4	This is part 4 of a 5-part tournament where Alton Brown picks the baskets with specific scientific, gastronomic techniques in mind. The theme of this episode is fermentation, with at least one fermented/pickled ingredient in each round. A basket ingredient in the appetizer round (champagne) was initially unveiled as a champagne flute, and the chefs were treated to a small lesson from Alton on how fermentation of grapes results in alcohol.	October 31, 2017	Alton Brown	Amanda Freitag	Alex Guarnaschelli	mutton chops, kimchi, cocoa nibs, champagne	red snapper, sourdough bread, purple cauliflower, natto	sauerkraut cake, pickled green strawberries, beer, passion fruit	Jason Rodriguez	Executive Chef and Owner from "
"34	13	424	8.9	Alton's Challenge, Grand Finale	This is the final part of a 5-part tournament where Alton Brown picks the baskets with specific scientific, gastronomic techniques in mind. There is no specific theme for the finale. A basket ingredient in the dessert round (sorbet) was shown as created by Alton via a dry ice fire extinguisher and sorbet mixture combined in a food processor. *For the first time in Chopped history, three competitors moved into the dessert round.	"
"35	1	425	8.4	Clam Clash	Guest judge Jordan Andino was a contestant from the Chopped season 15 episode, Heads Up!	July 18, 2017	Scott Conant	Amanda Freitag	Jordan Andino	little neck clams, ultra mizuna, vadouvan, banana chips	red grouper, candy-coated licorice, squid ink, petite purple broccoli	navy bean pie, guava, cherry spoon fruit, sgroppino al limone	Kristina Mellegard	Private Chef from "
35	2	426	8.6	Clock Shock	
"35	3	427	8.7	Food Truck Luck	All the contestants competing were food truck owners. Chef Musselmani has also competed on the 15th season of Hell's Kitchen.	September 5, 2017	Scott Conant	Amanda Freitag	Marcus Samuelsson	goat barbacoa tacos, Asian long beans, spring roll wrappers, chicken souvlaki	lobster rolls, bok choy, ramen noodles, chile de arbol	tropical fruit pops, candied nuts, chocolate covered bananas, dessert nachos	Suzette Montalvo	Food Truck Owner  'A "
"35	4	428	8.2	Waffles for the Win	Contestants were tasked to cook dishes paired with waffles.	September 12, 2017	Maneet Chauhan	Amanda Freitag	Joseph “JJ” Johnson	waffle batter, chicken tenders, chiles de arbol, Lay's Classic potato chips	liege waffle dough, sliced beef shanks in soy sauce, kumquats, mustard greens	waffle cookies, buttermilk, creamy organic peanut butter, dried strawberries	Bryan Lindsay	Executive Chef from Brooklyn  "
"35	5	429	8.3	Comfort Zone	The theme of this episode was comfort food in every basket.	September 19, 2017	Marc Murphy	Amanda Freitag	Geoffrey Zakarian	fried chicken, rainbow chard, fingerling potatoes, bacon grease	meatloaf mix, heirloom tomatoes, chanterelle, mushrooms, boxed mac & cheese	peanut butter & jelly sandwiches, strawberries, vanilla wafers, chocolate milk	Jayda Atkinson	Catering Chef from "
35	6	430	8.1	The Beets Go On	
